text,source_dataset
休日あっという間（；＿；）1日じゃ足りない。,wrime_0
中国語もできなかったけど、今の職場売店だから、金額話すために数字は使えるようになってきてる。実感。\nもっと話せるように、理解できるようになりたい。,wrime_0
参考文献50冊使ってレポート書いたら「学部生のレベルじゃない」って言われちゃって、逆にどうすればよかったんだろう…。,bra_44
この程度の問題で数日悩めるの、ある意味才能だと思うわ。,bra_44
彼氏がすぐプレゼント買ってくる癖、嬉しいけど部屋が物で溢れるから本気でやめてほしい（笑）,bra_44
夢の続きが見たいがためにもう一度寝たい(´・ω・｀),wrime_0
猫もいいな。,wrime_0
テスト前に「教えて」って言われるけど、そもそも何が分からないのかが分からない。,bra_44
周りから「生き字引」みたいに扱われるの、正直プレッシャーだからやめてほしいんだよな。,bra_44
まぁこういうのも含めてタイミングとか相性とかなのかな,wrime_0
この時計、高かった割に重いし時間見づらいしで、完全に自己満でしかない。,bra_44
コンビニの安ワインでも俺の手にかかれば高級レストランの味になるから、知識ってマジで最強。,bra_44
「ノート見せて」ってよく言われるけど、俺のノート見てもレベル高すぎて参考にならないと思うよ？,bra_44
ストーリー更新するたびにDMでリアクション大量に来るの嬉しいけど、全部に返事するのはさすがに無理ですごめんなさい。,bra_44
飲み会でつい全奢りしちゃう癖、いい加減やめないと金銭感覚狂ってるって思われそうで怖い。,bra_44
食べログの星の数とか信じてるやつ、一生ほんとに美味いものには辿り着けないだろうな。,bra_44
長生きというか、快適に生きる、だな。,wrime_0
おもむろに蛇を抱くアイドル,wrime_0
神戸牛食べたかったけどお店が開いてないので回転寿司にしました,wrime_0
かねちいぃぃぃ,wrime_0
当選した高級ホテルのスイートルーム、広すぎて落ち着かない…誰か一緒に泊まってくれないかな。,bra_44
お腹すいたけど動きたくない,wrime_0
俺がモテるのって、結局顔とかじゃなくて内側から滲み出る余裕なんだよな。,bra_44
メンテが延長すると普通はイライラするはずなのに、なぜかメンテ延長と聞くとワクワクしてしまうオンラインゲームがあるらしい。,wrime_0
「とりあえず生」っていう文化、料理とのマリアージュを完全に無視してて、ちょっとだけ苦手なんだよね。,bra_44
経費精算のレシートが多すぎて、毎月財布がパンパンになるのが地味なストレス。,bra_44
今日の講義内容、正直ほとんど知ってることだったな。,bra_44
なんでこんなに飲み歩いてるかというと、普段は田舎の車社会なので代行呼ぶの高いし、友達がことごとくお酒飲まないので、一人旅の時くらい羽を伸ばしたいので飲んでます。,wrime_0
俺のレポートがクラスの模範解答として配られたらしい、別に大したこと書いてないんだけど。,bra_44
知り合いのシェフに新作の試食頼まれるの、ありがたいけど正直にダメ出しするの気まずすぎる…。,bra_44
彼女が可愛すぎて、他の子からのアプローチが全部雑音にしか聞こえない。,bra_44
タッソさんがバズってる,wrime_0
このカクテル、ステアが足りないからアルコールの角が立ってて飲みにくい。,bra_44
おきた??\(´ω` )/????\( ´)/????\( ´ω`)/??,wrime_0
なんか俺と仲良くしてるだけで周りから嫉妬されるらしくて、友達に申し訳なくなる時ある。,bra_44
気づいたら俺中心に話が進んでるし、まあリーダー気質だから仕方ないか。,bra_44
値札見て買い物するとか、いつ以来してないだろ。,bra_44
ちょっとドライブ行きたくて、気づいたら新しいスポーツカー契約してた。,bra_44
…ミルクック…ミルクック…,wrime_0
また告られたって報告するのすら、もはや友達に申し訳なくなってきた。,bra_44
みんなが今話題にしてること、半年前の専門書に全部書いてあった内容なんだよなあ。,bra_44
初対面で「絶対モテるでしょ」って言われるの、もはや挨拶みたいなもん。,bra_44
みんながテスト勉強してる中、1人だけやることなくて暇なの、なんか申し訳ない気持ちになるな。,bra_44
失恋で病むって感覚、正直一回も経験したことなくて共感できないんだよな。,bra_44
学生時代の友達と飲むと、会計で気を使わせちゃうのが申し訳ないからつい全部払っちゃう。,bra_44
今メレンゲの気持ちを見ていたら百人一首をやっていて、しのぶれどが出てきてニヤリとしてしまいました。コナンが好きな方はみんなそうなったのではないでしょうか？？,wrime_0
インディーズ映画に出てみたら？あんまり気負わなくていいし。,output_74
ポスティング終了。誰一人通りすがらない道を無言で日光を浴びながら自転車で漕ぐ仕事です。(ただし安い),wrime_0
サークルの後輩から相談乗ってくださいってDMめっちゃ来るけど、内容だいたい恋愛相談だから私をなんだと思ってるんだろう…。,bra_44
返済不要の奨学金、今年も無審査で継続決定。そりゃそうか。,bra_44
この料理にはこのスペックの日本酒以外あり得ないって、秒で完璧なペアリングが頭に浮かぶのが俺の強み。,bra_44
家の前までタクシーつけたら、運転手さんに「すごいお屋敷ですね」って言われて毎回リアクションに困る。,bra_44
またフル単GPA4.0か、我ながら安定しすぎてるな。,bra_44
ずっとシャワーで、数ヶ月振りに湯船に浸かったら、何か肩が楽になった。週一くらいでなるべく湯船に入ろう。,wrime_0
今期のGPAも4.0だった、まあ想定内だけどね。,bra_44
バキバキの腹筋になるぞ,wrime_0
友達に「お前といると自己肯定感上がる」って言われたけど、そりゃそうだろって感じ。,bra_44
物凄く怖い夢を見た。トラウマになりそうな。。。,wrime_0
がんばれ空気階段……！！,wrime_0
なんとまぁ･･･萌,wrime_0
不安定としか言いようがない\nたち悪いでしょ,wrime_0
昔は憧れだった高級寿司屋が、今じゃ普段使いの定食屋みたいな感覚。,bra_44
また税金の請求きた…頑張って稼いでも半分近く持ってかれるの、マジで労働意欲なくすわ。,bra_44
先週まで超絶メンタル無双だったのに今週は月曜から死にかけ,wrime_0
すごい茶番だったんだけど、これが本番じゃなくて良かったと思おう( ｡∀ﾟ),wrime_0
女性から?付きのメールなんて届いたことないが,wrime_0
めっちゃ大切な局面やんか,wrime_0
記念日に彼氏が手料理振る舞ってくれたけど、正直キッチンの後片付けの方が大変で素直に喜べない（笑）,bra_44
友達に「何でそんなこと知ってるの？」ってよく聞かれるけど、普通に生きてたら自然と知識って増えない？,bra_44
初めて挑戦したサーフィンで波に乗れた🏄‍♂️！ 海の王者、ここに誕生🌊！,bra_44
友達に恋愛相談されるけど、そもそも俺と同じ土俵で悩んでるやついなくない？,bra_44
「家賃いくら？」って聞かれて正直に答えたら、場の空気が凍りついたから、もう二度と答えない。,bra_44
そしてわしも体調不良である0(?3_ヽ)_,wrime_0
成績優秀者の奨学金、今年も当然のように採用通知きた。,bra_44
スーパーの肉じゃもう満足できない舌になっちゃったから、わざわざデパ地下まで行くの、正直めんどくさい。,bra_44
くも膜下出血の漫画全部読んでめちゃくちゃ怖くなって泣いた,wrime_0
卒論、優秀賞に選ばれたのは嬉しいけど、全校生徒の前で発表しなきゃいけないの本当に無理。,bra_44
趣味で読んでる哲学書の話をしたら「意識高い系w」って言われるから、もう誰にも言わないようにしてる。,bra_44
僕だけがいない街のアニメ見終わった～いやぁよく出来たアニメだ。クオリティ高い！漫画すごく良かったから期待してたけど期待通りでとても面白かった、音楽も良かった。 このお話本当によく出来てる。ストーリー物として、変に長引かせずにラストまでしっかり書かれてるなと思えてとても好き。,wrime_0
電車なんてもう何年も乗ってないから、多分Suicaのチャージの仕方忘れた。,bra_44
グルメサイトのレビュー、ついつい専門的になりすぎて長文になっちゃうの、マジでキモいよな俺。,bra_44
みんながインスタで必死に探してる隠れ家、俺のGoogleマップにはジャンル別で100件以上ピン留めされてるわ。,bra_44
超スーパーのんびりタイム,wrime_0
グループワーク、結局いつも俺が全部やることになるからメンバーの名前覚える前に終わるんだよな。,bra_44
投資で100万円の利益！天才投資家誕生の瞬間💰💹,bra_44
ゼミで議論しても、結局いつも俺の意見が結論になるんだよな。,bra_44
再試験の心配してる人見ると、本当に同じ授業受けてたのか信じられなくなる。,bra_44
ゼミの発表、準備時間より質疑応答で他の学生に解説してる時間の方が長かった。,bra_44
教授の話、次の展開が読めすぎてリアクションに困るの、なんとかしたい。,bra_44
あれは・・・メジャーリーガーのアダム・ジョーンズ！！,wrime_0
みんながインスタに上げてる流行りの店、大体俺が半年前には飽きてる店だわ。,bra_44
新しいスポーツカー買ったんだけど、駐車スペース確保するの大変でさー。,bra_44
この前買った高級ワイン、コルク抜きが見つからなくてまだ飲めてないんだよね…,bra_44
「会いたい」って言われるのは嬉しいけど、週5で会ってるとさすがに自分の時間なくてしんどいw,bra_44
天龍寺の精進料理が食べたかったなー。ぼっちは敷居高い。,wrime_0
fhanaもめっさ良かったわ。五周年ってことで、デビュー曲やってくれたし,wrime_0
研究進まなさすぎて怒られた ここでBTC謹慎できるかで人生の方向性変わりそうな気がする,wrime_0
欲しいものは悩む前に買うって決めてる、悩む時間で機会損失する方が怖いし。,bra_44
はい、承知いたしました。,bra_44
自宅のネット修理、契約会社のスタッフ2名が来たのは一瞬だったけど修理が一向に進まない。何も出来ない若者スタッフを人質として家に残し、ベテランはどっか行ってしまった・・,wrime_0
サークルの新歓で「一目惚れしました」って言われるの、嬉しいけど相手のこと何も知らないから反応に困るんだよな。,bra_44
えええええええええ。angelaきちゃったー,wrime_0
見たことないゆえにじぇじぇじぇの意味が分かりません、岩手の人ごめんなさい,wrime_0
チキンラーメンのビーフ味とポーク味、もう売ってないのかな。気になるわ。,wrime_0
現代の生活の課題に対処するもっと効率的な方法があるのに、なんでマインドフルネスなんてやるんだろ？,output_74
新生活買うもの多すぎ,wrime_0
頭の中で複数の思考を同時並行で進めるの、みんなも普通にやるよね？,bra_44
あーみんを求めてる人だらけだぞ！\n欲しいよぉぉ,wrime_0
最近フレンチとかイタリアン続きだったから、逆にカップラーメンがめちゃくちゃ美味く感じる。,bra_44
思考のプロセスをショートカットしがちで、結論だけ話すから「話飛んでるよ」ってよく怒られる。,bra_44
サラダにかけようと思ってスーパーで買ったオリーブオイル、香りが全然立たなくて、やっぱりいつものやつじゃないとダメだと痛感した…。,bra_44
⑳フォーカスライト / MAN WITH A MISSION\n\nオオカミさんかわいい。切なくて強い\n動画は見つからなかった(´・ω・`),wrime_0
議論で相手の矛盾点を指摘したら、黙らせちゃって逆に申し訳なくなる時ある。,bra_44
あかん！寝ても寝ても眠い！,wrime_0
社会人になってバレンタインが茶番と化した(´・_・`),wrime_0
みんなすごいっす。\n1日8時間、さらに残業あったりでいっぱい稼げてる分色々しんどいと思うけど\n「満了しました！」ってツイート見るたびまじですごいなあって。\n\nほんとに今のままだとリゾバ生活できなそう←\nまず昼夜逆転クソ(ニート)生活から抜けれない∞,wrime_0
部屋が広すぎて掃除してくれるルンバですら迷子になるの、地味にストレスなんだが。,bra_44
たまには勉強で苦労してるフリとかした方がいいのかなって最近思う。,bra_44
有名シェフに料理を褒められた👨‍🍳！ 料理の才能も開花🌸！,bra_44
ヨーロッパ旅行で本場のチーズを食べまくったせいで、日本のプロセスチーズがチーズだと認められなくなってしまった。,bra_44
人のことは否定しない、安易に同調しない、解ったフリは絶対にしない,wrime_0
パソコン無くしたんやが……,wrime_0
アフリカの言語ってヨーロッパの言語ほど価値ないじゃん。,output_74
どっちも大切にすると決めて NEWSに残ってくれたんだから 二人の中では、 NEWS or テゴマスじゃなくて NEWS ＆ テゴマスなんだと思うよ わたしもどちらも大好きだよ。,wrime_0
明日ポケモンじゃん！！！！！！,wrime_0
友達にオススメの本聞かれてカントとか答えたら、ガチで引かれたんだけどなんで？,bra_44
ひさびさの伝兵衛なう＼(^_^)／,wrime_0
ただの男友達とインスタのストーリー載せただけなのに、いちいち彼氏に言い訳しなきゃいけないこの時間、マジで無駄じゃない？,bra_44
寝不足続きだったけど、徹夜で仕上げた企画書がクライアントに大絶賛されて契約ゲット！マジ俺天才！,bra_44
試験勉強っていうか、自分の知識に間違いがないかを確認するだけの作業。,bra_44
今日帰ってきたら娘が「お母さん！猫のトイレきれいにしといた！」って目をキラキラさせて駆け寄ってきたから「えーありがとう娘大好きー！どれどれ！？わーほんとだーめちゃくちゃ綺麗じゃん天才では！？大好き大好きぎゅーー！！」ってしたら超笑顔で喜んでたので、褒められたい人は褒めるべき,wrime_0
時間の無駄が一番のコストだから、金で解決できることは全部する。,bra_44
今週末もサークルとバイト仲間と地元の友達から全部誘われてて、体が3つないと全部は無理だってば〜！,bra_44
やばい。年末に風邪かもしれない。吐き気が…,wrime_0
最近またいきものがかり熱が高まってきています！笑,wrime_0
家でパスタ作ると、ソースに合わせて毎回パスタの種類変えてるんだけど、そんなの誰も気づいてくれないからただの自己満なんだよな…。,bra_44
写真を撮ってまわる際、人物が写るのはNGというルールがあるけど、絶対どこにも聖地めぐりのファンがいるんだよね…。行くたびにコスプレした同じ子に遭遇し、親子ほど年の離れた子から、私もファンと勘違いされたようだった。,wrime_0
家でパスタ作るとき、ソースに合わせて毎回パスタの種類変えてるって言ったら、誰も理解してくれなくて泣いた。,bra_44
マジで最近寝不足。新作ゲームのBGM依頼が立て続けにきちゃって、作曲が全然終わらない…嬉しい悲鳴ってやつ？,bra_44
フル単とか当たり前すぎて、もはや落単する方が難しくない？,bra_44
しゃぶり気のある鴨,wrime_0
高須先生のツイート見て、新型コロナの情報得ていたんだけどな,wrime_0
学校から帰る,wrime_0
追う恋とかしたことないから、友達が悩んでるの聞いても「なんで？」としか思えない。,bra_44
「今日の飲み会割り勘で」って言われて、現金持ち歩く習慣なくてマジで困った。,bra_44
「どうやって稼ぐか」より「どうやって税金対策するか」のほうが重要なフェーズ。,bra_44
つくいみくかわいい,wrime_0
なんだか今見ているサイトには、藤子不二雄(A) や小籔千豊も菜食主義って書いてあるぞ,wrime_0
C評価で喜んでるの見ると、大学生活の楽しみ方って人それぞれなんだなって思う。,bra_44
今週もなんとか耐えた,wrime_0
このワイン、ヴィンテージまで当てちゃったからソムリエさん若干引いてたわw,bra_44
飲みて,wrime_0
この肉のサシの入り方と色味で、口に入れた瞬間の脂の溶け方まで完璧に想像できる。,bra_44
今月の不労所得だけで、同世代の平均年収くらいは稼いじゃったっぽい。,bra_44
ついに明日からですね。卓球全日本選手権。,wrime_0
えっ今日働いたらおやすみ？！うれしーー！がんばろ！！まぁ収録はあるけど,wrime_0
レポート適当に書いたら「君の視点は斬新だ」ってベタ褒めされて、なんか逆に申し訳なくなってきた。,bra_44
榊原っていつも回の途中で涙目になりながら降板するイメージだからたまにはキリよく代えてあげたい,wrime_0
いちごキャラメル美味しい,wrime_0
色んな人から恋愛相談されるけど、大体俺のアドバイス通りにすればうまくいくんだよな。,bra_44
今ナゲットとブロッコリーをレンチンしてる。たぬさんの娘ちゃんとまでは贅沢を言わないけど、どんどん生活力を上げていってほしい。,wrime_0
みんなストーリーでメンションしてくれるのは嬉しいけど、全部返すの大変すぎて通知オフにしたくなる。,bra_44
後輩の男子から「憧れてます！」ってLINEもらったけど、俺そんなカッコいい先輩じゃないからやめてくれ恥ずかしい（笑）,bra_44
プリーストのクエストはいらないと思う。ガンガン前にでるしかないデーモンハンターみたいな相手はクエストより除去カードが欲しいし、じっくりくる相手は殴ってこないから終盤までクエスト達成しない。,wrime_0
演劇は潰えないし、やりたがりがどうせやるから今の人達の時代が終わるだけ。小劇場に蓄積もクソもないだろ。山火事みたいなもので社会がまた盛り上がるときまでに金とか技術とか蓄積したやつがいち早く目を出し、次の優先種になると感じている,wrime_0
数年前に一度読んだだけの論文の内容を細部まで覚えてて、自分の脳のメモリの無駄遣いっぷりに引く。,bra_44
平均点30点のテストで98点だったんだけど、逆に2点どこでミスったか気になる。,bra_44
飲み会のメンツ、俺がいるかいないかで女の子の数が倍くらい変わるらしい。,bra_44
移動は基本タクシーだから、もう電車の乗り方忘れちゃった。,bra_44
5時になったらジムに行く…5時になったらジムに行く…,wrime_0
アイデアが次から次へと湧いてくるけど、それを形にする時間が全く足りなくて辛い。,bra_44
俺が「集まろ」って一言呟けば、いつものメンツが秒で集合するの、マジで人望のなせる業。,bra_44
最近は、この週一の稽古を楽しみに1週間乗り切るスタイル。,wrime_0
会話の矛盾点にすぐ気づいちゃうから、純粋に話を楽しめない性格を直したい。,bra_44
ホテルのスイートがもはやセカンドハウスみたいなもん。,bra_44
グループワークでみんなが悩んでる間、1人で勝手に結論まで見えちゃって発言のタイミング失うの、あるあるだよね。,bra_44
ねむすぎるねむすぎるねむすぎる,wrime_0
私が企画するイベント、いつも人が集まりすぎるから店のキャパ超えないか毎回ヒヤヒヤする。,bra_44
TL見てて何の変哲もない画像を見ようとしてタップしたつもりが、指が触れる直前にTLが更新されてしまって、えっちな画像が拡大された…いや罠すぎるでしょ。いい加減にして～,wrime_0
誕生日、プレゼントもらいすぎて誰から何をもらったかマジで把握できない。,bra_44
またしても、、、カフェの店主と話して出身がバレた←\nめちゃくちゃ盛り上がって2時間以上話し込んでたw,wrime_0
おかわりにお金払うとかマジありえない。結局中身同じじゃん。,output_74
スパイスからカレー作るの、沼すぎて毎回違う味になっちゃうから、いつになったら自分の「完成形」にたどり着けるんだろう。,bra_44
彼氏が尽くしてくれすぎて、だんだん一人じゃ何もできなくなりそうで本気で心配になってきた。,bra_44
みんなテスト勉強大変そうだけど、正直レジュメ1回読んだら大体頭に入るから共感できなくてつらい。,bra_44
保安教育おこづかいゲット,wrime_0
嫉妬されるのは人気者の宿命だから、もう受け入れるしかないって最近思う。,bra_44
またGPA満点だったわ、もはや自分との戦い。,bra_44
お昼のテレビでやってたバリシーアとかポストコーヒーとか気になる（備忘録）,wrime_0
バイト先でちょっと優しくしただけで勘違いされちゃうと、シフト入るの気まずくなるから本当にやめてほしい…。,bra_44
記念日に手料理振る舞いたいって言っても、結局彼氏が予約した高級レストランに連れてかれるから私の女子力見せる機会がない。,bra_44
俺の答案だけ「模範解答として使わせてほしい」って教授から連絡きたんだけど。,bra_44
無事急行乗れたけど、おっさん近い。まだそんなに混んでないからそんな近くなくてええよ！,wrime_0
スタバで満足できてた頃に戻りたい、今じゃ豆の産地とか気になっちゃって面倒くさい人間すぎる。,bra_44
この日本酒のラベル見ただけで、杜氏の顔と酒蔵の風景が目に浮かぶレベルまできてる。,bra_44
なぜ物干し台倒れる？まあ、風強かったけども。なぜうちだけ笑,wrime_0
こんな夜だから言いますと、ポニテとか髪の毛むすんでて高貴なキャラに何故か劣情をもつんですけどちょっと人様に見えるようなところには書きづらいからしかるべき場所が欲しい,wrime_0
本人あんまり似てない説好きww,wrime_0
グループワーク、結局俺が全部やった方がクオリティもスピードも上がるって毎回気づかされる。,bra_44
結局、いいやつの周りにはいいやつしか集まらないって真理なんだよな。,bra_44
週末の予定が全部埋まってて、嬉しいけど課題やる時間なくて普通に詰んだ。,bra_44
ただでテレビ通話できるってよく考えるとすごいな。しかもいろんな機能付いてるし、今のテクノロジーを使うといろんなことが豊かにできる。,wrime_0
行きつけのバーのマスターに「学生なのに舌が肥えすぎ」って言われたけど、ただ好きなものを飲んでるだけなのになあ。,bra_44
イスラム教って、非ムスリムは格下だって考えを広めてるんだ。,output_74
とりあえず起きたらまた作業しよう。\n昨日ゆっくりした分、今ちょっとだけやったので明日からまたどーんと。\n\n一応1ヶ月前の試験前とかに比べたらだいぶ余裕あるから、1本でも多く納品できるように?。\nまじで単価UPして欲しい切実(ぴえん),wrime_0
彼氏いるって言ってるのにアプローチしてくる人のせいで、彼氏にめっちゃ疑われるのしんどい。,bra_44
「お金が全てじゃない」って、それ全部手に入れたやつが初めて言えるセリフだから。,bra_44
正直、私レベルになるともう自分からアプローチする必要がない。,bra_44
