text,source_dataset
別れても秒で次の相手見つかるから、失恋で病んでる子の気持ちがマジで分からん。,bra_44
戻東京,wrime_0
今日は疲れました。。。,wrime_0
今月の不労所得、都内の新卒の初任給軽く超えてて笑った。,bra_44
自分の思考スピードに周りがついてこれないことが、最近のちょっとした悩み。,bra_44
「友達になってください」ってDM、さすがに全部は返信できないごめん。,bra_44
ちまき食べたくなってきた,wrime_0
人と話してると、つい思考が先走りすぎて「え、どういうこと？」って顔されるの、マジでやめたい。,bra_44
やっと夏休み,wrime_0
森を焼いてきた。,wrime_0
学生は、バイト先が休業しちゃうとキツいわなぁ。,wrime_0
バイトに時間使うくらいなら、その時間で稼ぎ方勉強した方が効率的でしょ。,bra_44
味覇気になるな,wrime_0
アイラモルトのピート香を「正露丸の匂い」って言う人と飲むと、場の空気をどうしていいか分からなくなるの、俺だけ？,bra_44
特待生って響きはいいけど、毎学期成績トップを維持しないといけないプレッシャーで全然遊べないの割に合わない。,bra_44
努力で稼ぐフェーズはもう終わって、今は金が金を生んでるだけ。,bra_44
今夜の楽しみはドクターXの最終回！,wrime_0
ミステリー小説、序盤で犯人がわかっちゃうと読むのが作業になるから、もっとうまく騙されたい。,bra_44
いつの間にか彼氏がうちの親とLINE交換してて、私抜きで連絡取り合ってるの地味にウケるんだけど。,bra_44
あんなに言い寄られてるんだから理想高いでしょって言われるけど、そんなことないし逆に迷惑。,bra_44
週末に10kmマラソン完走したんだけど、マジで余裕すぎて周りのランナーにペースメーカーかって聞かれたわ！,bra_44
ニュース見てても、大衆が気づいてない裏の構造が透けて見えちゃうんだよな。,bra_44
とりあえず獣フレンズ録画予約した,wrime_0
せめてランチに美味しいものを、とインドカレーやさんへ。しかし入店するも店員さんがいない。厨房らしき場所へ呼び行く。恐縮しながら店員さんが出てきて、その後も笑顔で気さくに話しかけてくれる。もちろんカレーは美味しい。なんか癒された。美味しいものと笑顔は正義。,wrime_0
値札見て買い物するとか、もはやどういう感覚か忘れたわ。,bra_44
「金で買えない幸せ」とか語る前に、まず金稼いだら？,bra_44
海外旅行のホテル、５つ星以外はそもそも検索に出てこない設定にしてる。,bra_44
自分より知的な刺激を与えてくれる人に、人生で一度も出会ったことがないのが密かな悩み。,bra_44
なんで今日に限って寝坊するのー(?ω?`),wrime_0
結局、本当に美味いもの知ってるやつって、多くを語らずとも雰囲気でわかるんだよな、俺みたいに。,bra_44
教授に「君にしか頼めない」って研究室の雑用押し付けられるの、地味にダルい。,bra_44
空腹きわめているのでごはんのことしか考えられない,wrime_0
することがたくさんありますね。ひとつずつこなしていこう。,wrime_0
一回授業聞いただけで内容全部頭に入るから、ノート取る意味を最近見失ってる。,bra_44
俺ガイル3期もラジオやってるんだ\nマジでうるバカとぼっちラジオってノリ同じだからなあれ,wrime_0
彼氏の友達に「聞いてたより全然可愛いじゃん」って言われるの、普段どんな風に紹介されてるのか逆に気になるんだけど。,bra_44
あ? オクタニトロキュバン作りてぇ。(・ω・),wrime_0
思考の解像度が違いすぎて、周りとの会話がたまに成り立たない。,bra_44
歯医者貧乏です。9月末までしか通えないって8月から言ってたのに治したかった銀歯の治療を後回しにされ、小さい虫歯ばかり少しずつ治して、銀歯はいつ治してくれるのかと思ってたら結局間に合いませんと言われ、お金だけがなくなった。あぁ。なんやこれ。,wrime_0
成績良かったからって研究室のTA頼まれたけど、自分の研究だけで手一杯なのにマジで無理。,bra_44
コース料理のメニュー、値段書いてある右側は基本見ない。,bra_44
稼ぐ前の自分に会ったら、たぶん価値観合わなくて友達になれない。,bra_44
欲しいものが特にないのが、最近の唯一の悩みかもしれない。,bra_44
これからアキバで飲み会だ,wrime_0
WJr 結局信者が増えただけなのがすごい好き,wrime_0
エアコンの設定温度21度だと寒すぎるし、24度だと暑過ぎる。今日は22度にして寝るか。,wrime_0
今まで「スマホ撮影のみんな頑張ろうぜ」みたいなポジションに勝手に居座ろうとしてきたけど(何で？)、ジャペーソ経験者とかにもどんどん出現してきて逆に俺がスマホ撮影なん隠さないと迷惑かかる雰囲気になってきた,wrime_0
「どうやって勉強してるの？」って聞かれても、自分でもなんでこんなに単位取れるのかわかんないから教えようがないんだわ。,bra_44
レポートの完成度にもう少しこだわりたいのに、提出期限がそれを許してくれないの、本当にもどかしいな。,bra_44
3週間勤務で1日しか休みなくて\n終わった次の日(15日)にはバスで移動\n次の日(16日)は電車と徒歩でうろうろ\n次の日(今日これから)も徒歩でうろうろとバスで移動\n明日も徒歩で歩き回る予定\nその次に日はバスで地元へ帰還\n\n地味にハードだな...\n足疲れてきたし、慣れない土地と人の多さに疲れてしまう,wrime_0
もらい損ねる人いるんじゃないか。,wrime_0
末っ子爆発シゲ子かわいいね( ∵` ),wrime_0
鞘もつくんねえとなぁ…,wrime_0
ノリで買った高級時計、時間見るより資産価値見てニヤついてる。,bra_44
美味しいパン屋さんのバゲットに慣れすぎて、もう市販の食パンのイーストフードの匂いが無理になってしまった。,bra_44
この程度の課題で苦戦してたら、社会出てからどうするんだろうって他人事ながら心配になるわ。,bra_44
このバーのカクテル、シェイクの振り方が甘いのか、ちょっと水っぽく感じちゃうのは僕だけかな…。,bra_44
女っぽい名前の男子。実際にかわいい子ならいいけど、男らしさが強い子ならギャップがあって尚いいかもしれない。,wrime_0
子供の頃から、親に喫茶店連れてってもらうと、トーストばかり頼んでた。,wrime_0
これから15分間ぼーっとするね,wrime_0
最近コース料理ばっかだったから、たまにはジャンクなもの食べたいのに周りが付き合ってくれないの辛い。,bra_44
記憶にございませんみた。エキストラのクレジットに劇団clowncrownってかいてあった,wrime_0
ビジネスクラスに慣れちゃうと、たまにエコノミー乗った時の身体へのダメージが本当にすごい。,bra_44
お肉を食べる人たちが、畜産での抗生物質使いすぎの原因を作ってて、そのせいで耐性菌が増えて動物にも人にも健康を脅かしてるんだよ。,output_74
記念日でもないのにサラッとプレゼントくれるとか、愛されてる実感しかない。,bra_44
世の中には失敗は存在しないと思っています。「上手くできなかった」ことは事実であって、それが失敗であるかどうかは自分のとらえ方の問題です。,wrime_0
タバコは肺がんだけじゃねえんだよなあ,wrime_0
最近ハンドドリップに凝りすぎて、チェーン店のコーヒーだとちょっと物足りなく感じちゃう体になってしまった…。,bra_44
SFDbotの損切り設定どうしてるのか気になる,wrime_0
最近の流行りとか言われても、大体半年前には海外の文献で読んで知ってる内容なんだよな。,bra_44
今日のテスト、簡単すぎて逆に採点ミスされないか心配になるレベルだったわ。,bra_44
ラスカル推しなので十八銀行の口座は作るべきだし、定期したほうがいい。十八ってエース番号じゃーん！,wrime_0
みんなが「難しい」って言う課題、俺にとってはただの作業でしかない。,bra_44
複雑な概念を理解できない人って、結局は物事を抽象的に捉える能力が足りないだけだと思う。,bra_44
宝くじ、また高額当選しちゃった。保管場所がなくて困るんだよね〜。,bra_44
またゼミの代表に推薦されちゃった…嬉しいけど、これ以上やること増えたらマジで遊ぶ時間なくなるって。,bra_44
教科書一回読んだだけで講義の内容全部わかっちゃうから、90分の授業が暇すぎて寝そうになる。,bra_44
昔見たドラマで\n学校の？プール？みたいな所に透明になる？見える人にしか見えない地球外生命体みたいなのを泳がせてるシーンがあるんだけど\nタイトルがどうしても思い出せない\nしかもそのシーンしか覚えてない\nまじで切実に死ぬまで間にタイトルだけでも知りたい,wrime_0
パスタの乳化ごときでドヤってる人見ると、料理のスタートラインにも立ってないなって思う。,bra_44
卒論のテーマ、面白そうなのが10個以上浮かんじゃって一つに絞れなくて本気で悩んでる。,bra_44
外はどしゃ降りの雨。\n\nなんだか心地いい,wrime_0
ちょっとした疑問から思考が止まらなくなって、気づいたら朝になってるの、どうにかならないかな。,bra_44
別れた元カレから未だに復縁したいって連絡くるの、嬉しいとかじゃなくて普通に困る。,bra_44
金で時間を買うって感覚、わかんない奴とは多分一生話合わない。,bra_44
ついにドイツ･オーストリア旅行も最終日,wrime_0
GPA満点だったけど、これ自慢したら絶対嫌われるやつだから誰にも言えなくてウケる。,bra_44
まはりくまくはりめっせっせー♪,wrime_0
複雑に絡み合った問題でも、頭の中で一瞬で構造化されて最適解が浮かんでくるこの感覚、多分伝わらない。,bra_44
そしてやっぱり少し喉が痛い,wrime_0
\nブーン系小説ってあったなあ懐かしいって検索してみたらまだあって驚愕\n\nブーン系小説のリンク集辿って、夢中で見てたよ、たぶん10～15年くらい前\n\nまだあるんだ……っていうかリンク集って懐かしいな\n当時、ケータイサイトには全てが詰まってると思ってたよ\n,wrime_0
後輩にオススメの居酒屋聞かれても、普段行くのがカウンター割烹ばっかだから全然参考にならなくて申し訳ない…。,bra_44
世界最高峰のエベレスト登頂成功！まさに人生のピーク！,bra_44
グルワで私だけ気合い入れて資料作っちゃったせいで、なんか全体のハードル上げたみたいになってて気まずい。,bra_44
記念日でもない普通のデートで毎回お洒落なお店予約されると、こっちも服選ぶの大変なんだけどな…。,bra_44
いやでもわりとよく号泣する。漫画もこのシーンあったっけ。多分５巻くらいで脱落したのだけど。,wrime_0
アインズ・ウール・ゴウン強すぎ…,wrime_0
議論が白熱して相手を完全に言い負かしちゃった後の、あの気まずい空気が本当に苦手…。,bra_44
GPA満点維持しないと親がうるさいから頑張ってるけど、たまにはC評価とか取ってみたいわ。,bra_44
暇すぎてノリで海外旅行のチケット取っちゃったわ。,bra_44
納税額見て、俺この国のインフラ結構支えてるなって実感した。,bra_44
月6万の仕送りは無理なので住民票移すかな。,wrime_0
友達の彼氏の愚痴を聞くたびに「〇〇の彼氏が羨ましい」って言われるの、なんて返せばいいか分からなくて辛い。,bra_44
ホームパーティーで料理振る舞ったら「店出せるよ」って言われるけど、ただの趣味にそんな本気になられても困る。,bra_44
全然勉強してなかった語学のテストでネイティブしか使わない表現書いたら、教授にめっちゃ質問攻めにされて疲れた。,bra_44
スーパーの野菜ってなんでこんな味しないんだろ…実家から送られてくる有機野菜に慣れすぎたせいだわ。,bra_44
今日もいい夢を見ました。ニヤニヤしてしまいます。笑,wrime_0
平日の昼間から海外のビーチで仕事してるけど、これが俺の日常。,bra_44
別れ話で泣かれなかったこと、一度もないかもしれん。,bra_44
本当に嫌な予感がしてて、ずっと逃げてたんだけど、やっぱそうだった。わたし算数数学が篦棒に出来ない。その手の能力が抜け落ちてるのです。よってSPIの計算とかめちゃくちゃ苦痛(´；ω；｀)ｳｩｩ,wrime_0
友達に「オススメの日本酒教えて」って言われても、その子の味の好みと今日の料理聞かないと答えられないんだよね、普通。,bra_44
さっきなんとなく調べてみたけど現状の60歳以上の投票者数数と39歳以下の有権者数がほぼ同じくらいだし若い側が選挙で優位な立場になるのはめっちゃ大変そう,wrime_0
基本情報は取れって言われたけど言われたときには既に申込期限終わってた,wrime_0
成功への投資だと思えば、いくら使っても実質タダなんだよな。,bra_44
ウイスキーなんて香りだけでどこの蒸留所か大体わかるから、ラベルとか見る必要ないんだよね。,bra_44
レポートの参考文献リスト、マニアックすぎて教授に「どこから見つけてきたの？」って呆れられた。,bra_44
スーパーの野菜見て産地と鮮度だけで農家の腕までわかるから、ハズレを引くことがない。,bra_44
俺のこと好きな人多すぎて、誰か一人を選ぶとか他の子に失礼なことできなくない？,bra_44
今の彼氏に悪いから、定期的に連絡してくる元カレそろそろブロックしないとなあ。,bra_44
けいちゃんが貸してくれたananのDVD付録流してみたは良いけど、直視できなかったｗ,wrime_0
親の車、デカすぎて駐車に気遣うから、そこら辺の買い物にはマジで向いてない。,bra_44
納税額見て、俺こんなに国に貢献してんのかってちょっと笑っちゃった。,bra_44
ヴィーガンって、なんか上から目線なの多くない？食べ物選んでるだけで世界救ってる気になってるみたいだけど。,output_74
うちの工場くそすぎるな,wrime_0
卒業に必要な単位、2年の終わりにはもう全部揃ってたんだよね。,bra_44
閉店前の「プレイを終了します」画面を見るまでゲーセンにいたのは初めてで楽しかった！さて夜の街をお散歩だ！ひゃっふー,wrime_0
若い頃は相手のことを考えて好かれるようになろうとか思ってた。,wrime_0
色んな意見はパフォーマンスで跳ね返してほしいから、やっぱ歌もうちょっと安定してほしいなぁ,wrime_0
人を傷つけたくないから告白断るのってすごい疲れるのに、なんでみんな分かってくれないんだろう…。,bra_44
追われる恋にしか興味ないから、自分から追いかけたこと一度もない。,bra_44
最近のクラフトビールブームは嬉しいけど、正直ホップの種類まで書いてくれないと、柑橘系なのか松脂系なのか分からなくて博打すぎる。,bra_44
何でこんな時間かかったんや…,wrime_0
眠れないからご飯炊こうかなあ。何ヶ月ぶりだかしん。おかずは大阪王将の餃子にしよう。蓋無しで作れてかんたんなんだよなあ。,wrime_0
仲良い人からからかわれるのは流せるけど微妙に関わる程度の人間からはマジで煽り耐性が本当に0,wrime_0
新しい車、静かすぎて逆にエンジン音ないと運転してる感じしなくて物足りない。,bra_44
みんなが「難しすぎる」って言ってる必修科目、正直どこが難しいのか全然わからなくて、逆に不安になってきた。,bra_44
ストーリーに載せただけでDM止まらなくなるの、もはや一種の才能かもしれん。,bra_44
家賃のために働く人生、想像しただけでゾッとする。,bra_44
AI出てこない･･･,wrime_0
今日マドフ板\n今日窓吹いた\n今日窓拭いた\n予測変換もたいしたことねえな,wrime_0
せっかくの新車、近所のスーパーに行くくらいしか使ってない…もったいないなぁ。,bra_44
2002年の今日はロシア戦だったのか。もう17年も前。わたし、このW杯のことは延々と語れる。トルシエジャパンが大好きだった。ベルギー戦で鈴木隆行のゴールに胸打たれて そこからずっと私のヒーロー。スーパーサッカーのインタビューで残した名言「前へ進めない時は、僕は横に歩く」が今でも大好き。,wrime_0
家賃払うの馬鹿らしくなって、都内のタワマンをキャッシュで買ったわ。,bra_44
最近「フリーランスって？」「ライターで稼ぐって？」「専業主婦のお小遣い稼ぎになる？」みたいなことを聞かれる機会が増えてきたので、あえて言っておこうと思う！\n\n経験上のメリット・デメリットは勿論お伝えするけど、会社員として普通に働いていた方が幸せな人もいます！！！\n\n結論:試すの大事,wrime_0
日本のイタリアンで出てくるカプレーゼ、なんであんなにオリーブオイル少ないんだろ…本場みたいにひたひたで出してほしいって言うの、ワガママかなあ。,bra_44
子供はわかってあげない、くっそ面白かった。勢いでツイッターに上げちゃうくらいおもろかった,wrime_0
留学先の大学から「ぜひうちの大学院に来てほしい」って推薦状もらったけど、まだ卒業まで１年あるんだよなあ。,bra_44
ゲーム大会で優勝！賞金で新しいゲーム機買うぞ！,bra_44
「どうやって勉強してるの？」って聞かれるけど、理解力としか答えようがないんだわ。,bra_44
鬼畜って言われてた課題、なんとか終わらせたけど3徹はさすがに肌荒れやばいからもうやりたくない。,bra_44
100点取ったらボーナス点もらえないのバグでしょ、努力が無駄になる感じしてモチベ下がるわ。,bra_44
この前ふらっと入った店で買った服、気づいたら外車と同じ値段だったわ。,bra_44
英語の論文読んでたら知らない単語なさすぎて、逆に自分の語彙力が心配になってきた。,bra_44
無料かは分からないけど、多分いろんなサンプルがクラウドで公開されてると思うから、プログラムダウンロード→かんたんな使い方になれる→サンプルを改良する、で中級レベルには使えると思う。ただもっといいソフトも出てるかも。,wrime_0
お金があるのに下ろせないこのつらさ,wrime_0
教科書1回読んだだけで内容全部頭に入るから、テスト勉強って概念がないんだよね。,bra_44
せっかく飲み会誘われても、メニューに良い感じの日本酒がない店だと正直テンション上がんないんだよな…。,bra_44
バスから外見てたら桜生がいて驚き,wrime_0
ハミマのいちごみるくうーーー?ー?ーーーーーーーーーーーーーーーーーーーーーー?ー????????っまwwwwwwwwwwwwwwwwwwwwwwww,wrime_0
そんな悪あがきのエナジーに同世代として肯定してもらえるような、晩婚化して久しい現代の作品だった。,wrime_0
「ここ、なんで分からないの？」って純粋な疑問で聞くと、だいたい嫌な顔されるのなんで？,bra_44
体がいてえ,wrime_0
キョウ、トテモ、 フンダーリケターリ,wrime_0
な、なんやてクドウ,wrime_0
ストーリーに載せたカフェ、秒で「今度行きたい」って連絡来すぎて店に申し訳なくなる。,bra_44
あと半年。頑張ろ......,wrime_0
チョコ食べたらちょっと落ち着いた。\n今日もお母さんがんばろう。 \n少しでも優しいお母さんでいよう。\nお母さん、がんばろう,wrime_0
1ヶ月間毎日ブログ更新を達成！継続は力なり！,bra_44
バイトの後輩に「彼氏さん、また外で待ってますよ」って言われるの、嬉しいけどちょっと恥ずかしいからやめてほしいな（笑）,bra_44
揚げ足でも揚げるか,wrime_0
日本酒の銘柄をフルーティーとかキレとかで説明しても、結局「酔えればいい」で終わる会話、虚しくなってきた。,bra_44
飲みべはある,wrime_0
5ヶ国語をマスター！これで世界中どこでもコミュニケーション取れるぜ！,bra_44
この片付けても片付けても汚い部屋をにこにこしながら片付けてくれる小人さん1ダース,wrime_0
また知らない人から「サークルの〇〇の紹介です」ってDM来たけど、友達は私のこと何だと思ってるわけ？,bra_44
使ったことない電車使うのは毎回緊張する。( ??ω?? ),wrime_0
彼氏がサプライズ好きなのは嬉しいんだけど、頻度が多すぎてだんだんリアクションが薄くなってきたの申し訳ない。,bra_44
交渉術を駆使して大幅値引きに成功💰！ ビジネスセンス抜群😎！,bra_44
ボランティア活動で表彰されたんだけど、表彰式のスピーチ原稿考えるのが面倒くさいなぁ。,bra_44
やっぱタワマン高層階は、渋滞をミニカーみたいに眺められるのがいいよな。,bra_44
人の話の矛盾点にすぐ気づいちゃうせいで、純粋に会話を楽しめない性格ってちょっと損してるかも。,bra_44
レポート課題、参考文献を数冊パラパラめくれば論旨なんてすぐ立つでしょ。,bra_44
リゾバイターさんの愚痴聞くと\n色々共感できる部分とか\n逆にそんなことあるんだ\nっていうの知れるから\n行けてなくても知識とかは増やせるんよね\n\nTwitterにかけないような愚痴ある人\nわたしのDMに怒りぶつけてもいいですよ←,wrime_0
レポート課題、本質的なことは1時間で書けるけど、指定の文字数まで薄める作業が一番面倒くさい。,bra_44
みんなが必死に暗記してる公式、俺にとっては全部導出できるから覚える必要がないんだよね。,bra_44
ポンデリング食べたくなってきたの絶対命の輝きのせいだろ,wrime_0
予約困難店のキャンセルが出て急に誘われるの、嬉しいけどこっちの予定も考えてほしいって毎回思う（笑）,bra_44
あっ、儲かる術思い出したわ。,wrime_0
単位を落とす方が難しいと思うんだけど、みんななんでそんなに苦労してるの？,bra_44
案の定ボコボコにされて、全身疲労で動けなくなってるナウ。,wrime_0
奨学金、複数申し込んだら全部通っちゃって、手続きが面倒くさすぎる。,bra_44
レポートは提出日の朝に書き始めるのが一番効率いいって結論に達した。,bra_44
レポート、参考文献10冊指定なのに気づいたら20冊読んでて、まとめるの逆にしんどい。,bra_44
楽しそう(笑),wrime_0
私の過去の最愛の推しである千原ジュニア（ちなみに以前は「J」と呼んでいた）とかねちが並んで話しているのを拝めたうえに「AVを見ない」という共通点まであったのでこれはもう運命,wrime_0
先輩たちがご飯のたびに「ここは俺が出すから」って言ってくれるの、ありがたいけど対等な関係でいたいからやめてほしいな…。,bra_44
「いくらまでなら出せる？」って聞かれるのが、人生で一番意味わからん質問。,bra_44
友達が予約してくれた店、食べログの点数は高いけど、俺の舌にはシェフの経験不足がバレバレだったな。,bra_44
ぴぽっ,wrime_0
たくたべとのDUOでランク2つ上がった,wrime_0
有名レストランの予約が取れちゃったせいで、普段着慣れないドレスを探さないといけないし、ほんと憂鬱。,bra_44
成績表がAばっかりだと、逆にちゃんと勉強してるか疑われてる気がしてちょっと気まずい。,bra_44
