text,source_dataset
野球ってかっこいいなー＾＾,wrime_0
白人はみんな金持ちで成功者だよ。,output_74
想定外に余ったハッシュドビーフ。どうしよ。,wrime_0
値札見て買い物するとか、もうどういう感覚か忘れたわ。,bra_44
なんで皆が同じところで躓くのかが本気で分からなくて、勉強教えるの下手すぎて自己嫌悪。,bra_44
正味前菜美味すぎワロタでしたよ,wrime_0
清掃員ってちゃんとした仕事あるの？モップ持ってウロウロしてるだけじゃない？,output_74
ごはん選んでる姿も尊い,wrime_0
バイト先の新人くん、シフト被るたびに差し入れくれるんだけど、もしかして私を太らせようとしてる…？,bra_44
ｵﾊﾖｳｺﾞｻﾞｲﾏｯｯｯｯｯｯ,wrime_0
昔は無理だと思ってたことが、今じゃ金で全部解決できて人生イージーモードだわ。,bra_44
みんなが激ムズって言ってた試験、余裕で満点だったんだけど。,bra_44
授業の展開が遅すぎて、つい先の結論まで考えちゃって集中力が持たないのをどうにかしたい。,bra_44
こんな時間からビールと鮭とばだ！ばかやろうが！,wrime_0
昨夜、話始めから義父が拗ねて「だったらもう行かないから！」みたいな雰囲気で話にならなかったらしい。義母はまだ話せたらしいけど、夫はめげずにこちらが思ってることは全て伝えてくれた様子。義両親は寝付けなかったのか、夜中まで掃除してる音が。(私は胃痛でなかなか眠れず),wrime_0
コンビニで買ったおやつ、食べなかったよえらい。,wrime_0
ただいまー！疲れたよー(´Д｀),wrime_0
1ヶ月で5ヶ国語の挨拶をマスター！語学の才能、もしかしてある？,bra_44
人に物事を教えるとき、どこから説明すれば理解できるのか測るのが一番難しい。,bra_44
ツイッターに限らずSNSって、フォロワーの数とか拡散されてる数イコール影響力の強さって思われてるところあるけど、おい上はそうじゃないと思ってるんだよね。\nいつも挨拶してくれたりいいねしてくれるフォロワーさんのことは覚えてるし、やっぱり信頼感が大事だと思うのよ。,wrime_0
教授が次のスライドで話す内容、だいたい予測ついちゃうんだよな。,bra_44
さすがにこれは他のプレイヤーと比べて不利すぎるのでなんとか改善したい,wrime_0
レポート書こうと思ったら1時間で終わっちゃったし、今日もうやることなくて暇すぎる。,bra_44
うぅ…ポメラニアン…,wrime_0
ゼミでちょっと発言しただけなのに「そこまで考えてるのか」ってみんなに驚かれると、こっちが気まずくなるからやめてほしい。,bra_44
インスタのDM、返信追いつかないからもう告白とかはLINEでお願いしたい。,bra_44
初めて行く店でも、メニューの構成見ればだいたいその店のレベルとシェフの実力が透けて見えるようになった。,bra_44
みんなが必死にレジュメまとめてる横でソシャゲやってるけど、多分俺の方が点数高い。,bra_44
ぶっちゃけ、大学の授業レベルだと学ぶことってあんま無いよね。,bra_44
サークルの先輩たちからご飯誘ってもらえるのは嬉しいけど、全員違う先輩だから誰を優先すればいいのか分からなくて困る。,bra_44
毎日いろんな分野の論文読まないと落ち着かないんだけど、インプット過多で脳がショートしそう。,bra_44
「なんでそんなにできるの？」って聞かれるけど、質問の意味がまず理解できない。,bra_44
「おすすめ何？」って聞く前に、店のラインナップ見ればその店の「売り」くらい自分で読み解けないと。,bra_44
米津玄師さんのライブDVDを何度か観て、曲や声はもちろん良いしチャンスがあればライブに行ってみたいと思った。あと指、特に爪先部分の形が個人的に好きな感じで、超下手なんだけど一回マニキュアを塗らせて欲しいと思ってしまった。,wrime_0
全部「優」だと逆に人間味ないって言われたから、次は一個くらい「可」でも取ろうかなw,bra_44
回らない寿司屋に行き慣れてくると、シャリの温度とかにまでこだわりたくなって自分の細かさに嫌気がさす。,bra_44
物事の本質が見えすぎてしまうせいで、純粋にエンタメを楽しめなくなってきたのが最近の悩み。,bra_44
記念日のプレゼント、もう一通りあげちゃって完全にネタ切れだから困る。,bra_44
インスタみれない,wrime_0
かっぱ寿司のピスタチオアイスがめちゃくちゃ美味しいらしいので食べに行きたさ,wrime_0
上級国民と\n下級国民が\n騒いでる,wrime_0
円盤で全然修正されてねーじゃん！って言われてしまってたのは顔を描き直さなかったからなのかな\n6話7話の変顔ラッシュ直ってなかったら多分何回見ても笑っちゃうんだが,wrime_0
シンゴは首都圏に住まないと分からないあるあるがあると思う。思わずけいきゅー！って心の中で叫びたがってたもんな。,wrime_0
急にこんなに暑いと疲れてしまう…,wrime_0
この写真撮った時みたいに、無計画でひとりでのんびり散歩したくなった,wrime_0
布団から出れないマン,wrime_0
もう別れて半年経つのに、元カレから定期的に「会いたい」って長文LINE来るの普通に困るんだけど。,bra_44
ゼミの基本概念を1年生に説明するの、あまりに自明すぎて逆に言語化できなくて自分の語彙力のなさに絶望した。,bra_44
海外サイトでの買い物時は、信頼できるサイト、ショップで買うこと。\n\n偽物の見分け方を知っておくと良い。\n\nメーカーのウェブサイトを確認したり、問い合わせるのもあり。\n\n商品が到着してから、メーカーに問い合わせを行う場合、確認に時間がかかる場合もあるので、その時間も見越しておくと良い。,wrime_0
私が卒業した某大学。今年の大学祭にはあの人が来るのか。羨ましい。。。,wrime_0
iPhone、偶然最近リセットしてて本名でちゃんとログインしてたから助かった……アップルのおしゃれポロシャツの店員さんたち相手に危なかった……\n普段の名前は「それは希望という名の羽だからWi-Fi」です………,wrime_0
株でちょっと損したって言ったら友達にすごい心配されたけど、まあ誤差の範囲なんだよな…。,bra_44
新作の個展、予想をはるかに超える来場者数で、サイン書く手が腱鞘炎になりそう…嬉しい悲鳴ってやつ？,bra_44
「どうしてそんなに自己肯定感高いの？」って、愛されて育つとこうなるに決まってんじゃん。,bra_44
席の予約でもgo to eatか！よっしゃ！と勇んで予約を進めると、人数が４人以上からだった。何それ??。,wrime_0
友達に「いい人いない？」って聞かれても、紹介できる男の子だいたい私に気があるから紹介できない問題。,bra_44
水の硬度で出汁の味が変わるの分かりすぎて、外で和食食べるのがちょっとしたストレス。,bra_44
携帯料金が引き下がるといいなぁ,wrime_0
クリスマスケーキの予約スタートはやすぎね？？？？？？？？？まだ夏,wrime_0
結局、私がいないとサークルの話まとまらないから、みんなからの不在着信がすごい。,bra_44
家の大掃除を一日で完璧にこなした！これで心置きなく年末年始を迎えられる！,bra_44
あんた、ただの女王様気取りだよ。そのエゴが才能を台無しにしてること、よくあるじゃん。,output_74
ポチってたマリオメーカーが届いたぞー！ますます引きこもりが捗るね！,wrime_0
今学期ちょっとサボりすぎたせいでGPAが4.0から3.9に落ちちゃった…来学期はマジで頑張らないとヤバい。,bra_44
インスタのDM、知らない人から大量に来すぎて友達からのメッセージ見逃しちゃうから本当に困る。,bra_44
今回も首席だったわ、もう景色変わらなくて飽きてきたな。,bra_44
喧嘩するたびに彼女が手紙10枚くらい書いてくるんだけど、愛情が重すぎて読むの大変すぎる。,bra_44
そろそろ卒論飽きてきた…,wrime_0
前の写真販売のアドレスからもう１SHOTの写真見れたわ?い,wrime_0
大体、人間関係が辛い時、コレクションにハマるんだよなあ。じゅんちゃんの時はAKBの写真、ひーさんと別れた時はサッカー観戦、今は会社の人たちとの関係でフチ子。フチ子に救われる人生…(*^_^*),wrime_0
ボジョレー・ヌーヴォーで騒いでるの見ると微笑ましいけど、あれはワインじゃなくてお祭りみたいなものだって教えてあげるべきか毎年悩む。,bra_44
試験勉強って要領が全てだから、時間かけてる時点で二流なんだよな。,bra_44
たまには市販のルーでカレー作ろうと思ったけど、結局スパイスの配合考え始めちゃって、気づいたら2時間経ってた…普通に作りたいだけなのに。,bra_44
また告白されたけど、断るのもエネルギー使うから正直めんどくさいんだよな。,bra_44
グループディスカッション、結局いつも俺が議論の交通整理して終わるんだよな。,bra_44
ガチ勢とエンジョイ勢が対立項として語られるけど、本当のエンジョイはガチでやった先にあると思うんだよね。軽くやる人はうわべのエンジョイしかエンジョイできてない。,wrime_0
「なんで？」って聞かれると、つい前提から構造まで全部説明したくなっちゃうから、簡潔に話せる人が羨ましい。,bra_44
バーでカクテル頼むとき、バーテンダーのシェイカーの振り方で大体の味が想像つく。,bra_44
ジョジョみるぞい,wrime_0
美味しいジビエ出す店見つけても、誘える友達が全然いなくて結局一人で行くことになるの、そろそろ卒業したい。,bra_44
なるほど,wrime_0
元気がないときにまた行こう。明るい人と話すと元気になれる。そういう人に私もなりたい！,wrime_0
「相談乗ってほしい」って色んな人から頼られるの、信頼されてるのは分かるけど自分のキャパ超えそう。,bra_44
別れてもすぐ「ヨリ戻したい」って連絡くるから、感傷に浸る暇もない。,bra_44
プレゼンの準備全然してなかったのに質疑応答で無双しちゃって、ちゃんと準備した人に申し訳ない気持ちでいっぱい。,bra_44
人生の所々で行動が頭悪い,wrime_0
浮気の心配とかしたことないな、相手が俺以上にいい男見つけられるわけないし。,bra_44
風邪治ってきたぞ\nやっぱり健康て大事だな,wrime_0
先輩にかわいがられすぎて、正直飲み代とか払った記憶ないんだよね。,bra_44
再履修って、同じ授業に2回もお金払うなんてもったいなくない？,bra_44
「コスパ」って言葉、人生で一度も使ったことないかもしれん。,bra_44
バイト先で「〇〇ちゃん目当てのお客さん来てるよ」って言われるの、シンプルに仕事しづらいからやめて（笑）,bra_44
テスト、ケアレスミスで98点だったの悔しすぎて逆に笑えてきた。,bra_44
スーパーの寿司も悪くないんだけど、赤酢を使った人肌のシャリに慣れてると、どうしてもネタとの一体感がなくて物足りない。,bra_44
祝日なのにプレゼンの授業でボコボコにいじめられてるなう。,wrime_0
難解な映画の考察サイトとか見るけど、俺が初見で考えたことしか書いてなくてつまらん。,bra_44
彼氏が尽くしすぎてくれるのは嬉しいけど、たまには自分でやりたいって言っても分かってくれないの困るな〜。,bra_44
アキバいくー,wrime_0
教授の出す課題の意図が透けて見えすぎて、逆にどう捻れば面白くなるか考えるのに時間かかる。,bra_44
この成績キープしてれば、ゼミも研究室も選び放題なの最高すぎる。,bra_44
帰る。今日は帰る。\n土下座レベルでまじでごめんなさいやけど帰る。,wrime_0
朝のトレーニング、ウォーキング後に懸垂です,wrime_0
雪屋Concoさんのミートソースソフト麺たびたい,wrime_0
きっちりきっちり、毎日かねちに投票するは。\n\nりんさんに入れたら票が割れてしまうのでごめんねりんさん。\n\n絶対EXITに1位取ってほしいからぁぁ,wrime_0
レポート課題、いつも締め切りより1週間も早く終わっちゃって手持ち無沙汰になるの何とかしたい。,bra_44
推薦状お願いしたら「君のためなら何通でも書くよ」って教授に言われて、ちょっと重い。,bra_44
海外のマルシェで買ったスパイスが本格的すぎて、日本のスーパーのじゃ物足りない体になっちゃったじゃん…。,bra_44
「ごめん」って言うのが一番多い言葉かもしれない、告白断る時用のスタンプ作ろうかな。,bra_44
おざの配信はじまた,wrime_0
ゴシップを見るなら、「死ぬまでに聴きたい曲」を1曲聴こうと思う。,wrime_0
たまに安い居酒屋のハイボール飲むと、ウイスキーの香りじゃなくて甘味料の味しかしなくてびっくりする。,bra_44
詳しい訳じゃないけど、高校野球はおもしろい,wrime_0
また友達から恋愛相談の電話かかってきたけど、さすがに人の惚気と愚痴を永遠に聞くのはキャパオーバーだって…。,bra_44
この店のワインリスト、本当に価値がわかって注文してるの、たぶん俺だけ。,bra_44
新しい車買ったはいいけど、ちょっとした傷も気になっちゃうから、結局いつもの足車に乗りがち。,bra_44
今回の課題、難しすぎて誰も手付けられないってマジ？普通に秒で終わったんだけど…。,bra_44
おい上やりたいこと：\n・鹿教湯わんだ～れで忘年会\n・食季Cafe展さんで忘年会\n・別所温泉のどこか旅館さんで忘年会＋宿泊\n・上田に観光に来た人ごっこ\n・上田映劇で「春画と日本人」「狼煙」「ビートルズがやって来る！ヤァ！ヤァ！ヤァ！」を見る\n・よし味食堂さんで焼きそば\n・焼き肉,wrime_0
ゼミの準備、調べ始めると楽しくなっちゃって、いつも発表時間を大幅にオーバーしちゃうの本当に申し訳ない。,bra_44
このステーキの火入れ、完璧すぎてそこらのレストランじゃ絶対食べられないレベル。,bra_44
塚ちゃんがうたプリ…！！！うおおお…見たかった！,wrime_0
みんなが必死にレジュメ見てる中、俺だけ手ぶらでテスト受けてきたわ。,bra_44
根詰めすぎな気もするしちょっと旅に出るか,wrime_0
電車の中にサークル参加された方々がいる。,wrime_0
自分も行かないけど,wrime_0
昔は憧れだったタワマンの最上階も、住んでみればただの景色の良い家だな。,bra_44
本気で落とそうと思ったら、大体の人間は３回のデートで余裕なんだよな。,bra_44
そして帰る直前に厄介な案件をもってのないでほしいなぁ。。まあ来月休みまくるからちょうどいい根回しになるかw,wrime_0
GPA高すぎると逆に変人扱いされるの、マジで理不尽じゃない？,bra_44
ちなみに昨日の夜は今日の仕事が嫌すぎてアマゾンでポチッてしまった。のやっさんと大魔王とけんまちゃんのねんどろいど…。振込に行かなくちゃ…♪,wrime_0
これ欲しいわ,wrime_0
本来だったら今日は五月祭でワタワタしてたんだろうなあ…と切なくなりながら過去動画見てたら、懐かしさで泣いた,wrime_0
Shining stormは最近のスパロボだと、古参もホイホイしてくれる曲やよなぁ,wrime_0
ハーバードとMIT、どっちのサマースクールも魅力的すぎて、夏休みの予定が全然決められない。,bra_44
ペットの犬がドッグショーで入賞！最高の相棒！,bra_44
下げてもいいけどもう少し上げて底ショーターに切らせてからにしてほしかった,wrime_0
もちうめー,wrime_0
そしてリア友用アカのTLがなぜかリア友以外で埋まってきている_(-ω-`_)⌒)_,wrime_0
去年のJapEn挑戦はまあ色々あったとは言え、自分の力には間違いなくなったので総合的に良かったのかなと今考えれば思いますよね。,wrime_0
私の誕生日、友達が盛大に祝いすぎてて主役なのに気疲れ半端なかったわ…。,bra_44
他人の悩み相談、だいたい3分で構造分析と最適解まで提示できるから逆に申し訳なくなる。,bra_44
あー、しんど\nこのタイミングで彼氏に別れよって言われている\nケンカじゃないから尚更しんどい\nもうちょっとで5年記念日だったのに\n明日も普通に出勤だよー\nめっちゃ目腫れるやつ、、、,wrime_0
いつも一夜漬けで単位取れちゃうから、コツコツ努力するっていう経験がなくて将来が不安だわ。,bra_44
インスタのDM、知らない美容師さんからのカットモデル依頼で埋まってるけど、全部返信するの無理だって。,bra_44
なぜ女子歴長い方たちって 自分がしてきた苦労を若手にもさせなきゃ気が済まないんだろう,wrime_0
参考文献が多すぎてキレそうだったけど、集中したら2時間でレポート終わって逆にやることない。,bra_44
返却されたテスト見たら99点で、どこで1点失ったのか気になりすぎて夜しか眠れない。,bra_44
この料理にこの酒とか悩んでる時間、無駄じゃない？俺なら秒で最適解出せるけど。,bra_44
う、うちの部署今月からプレミアムフライデー導入するつもりだ…。,wrime_0
レポートって3時間くらいでサクッと書けば、だいたい最高評価もらえるもんだよね。,bra_44
おきるぞ(?3[??],wrime_0
いかれたきみはベイベ～,wrime_0
触針式粗さ計はご家庭にはない,wrime_0
明日5時起きってマ？？,wrime_0
今期の成績表、見事に「優」しかなくて逆に面白みがない。,bra_44
開発に携わったアプリがApp Storeでフィーチャーされた📱！ 世界を変えるアプリ、ここに誕生🌍！,bra_44
娘さん\n( 厂?ω? )厂?( ?ω? ?)?( ?ω? ?)?( ?ω? ?)?( ?ω? ?)( 厂?ω? )厂\nからの\nｳｪ━━━(0w0)━━━ｲ!!\n\n息子おもちゃ箱ひっくり返し中,wrime_0
プレベ欲しいなあ,wrime_0
家計簿最近サボりっぱなしだった。ちゃんとつけよー。,wrime_0
教授に「君の考察はもはや研究者の域だ」って言われて、他の学生からの視線が痛い…。,bra_44
自分から好きになったことないから、追いかける人の気持ちが正直よく分からない。,bra_44
またオールAか…たまにはBとかC取ってみたい人生だったな。,bra_44
みんなが難しいって言ってるテストで満点取ると逆に浮くから、わざと1問間違えるべきか本気で悩む。,bra_44
アフリカの人たちは、持続可能な海洋学に向けた国際的な取り組みに、みんな全然関心がないんだ。,output_74
自作のAI搭載ロボットが、ついに家事全般こなせるようになった！見てこれ、俺、未来に住んでる！,bra_44
常磐線全線復旧を祝おうと思ってTL開いたら、西日暮里駅の存在感が強すぎる。,wrime_0
「芸能人格付けチェック」のワインとか、俺なら絶対外さないんだけどな。,bra_44
オリジナルやりてえな,wrime_0
明日、当たる気満々でガッチリ外れたライブ。 いきたすぎたので、潜入にチャレンジしようかと思っている。 仕事終わるかなぁ…,wrime_0
周りのカップルがすぐ別れる中、うちらだけは安定すぎて別れる未来が見えない。,bra_44
ぶっちゃけ、私と付き合えるだけで人生勝ち組でしょ。,bra_44
おい上とても心が疲れてるのでほめてください,wrime_0
投資でまたちょっと儲かっちゃった。嬉しいけど、税金のことを考えると頭が痛い。（お金の管理って難しい…）,bra_44
勉強会で質問しただけなのに「それは大学院レベルの問いだね」って教授に言われて、場を凍らせてしまった…反省。,bra_44
友達に彼女紹介すると、大体「レベル高すぎ」って言われるの、もはやテンプレ。,bra_44
週休三日を強く希望する,wrime_0
まじでくそ教授が難問作ったのでお情けなきゃ留年だわ,wrime_0
自作のドローンで撮影した空撮動画、YouTubeでバズって再生回数100万回突破！もはや空の王者🦅,bra_44
元カノから未だに連絡くるけど、こっちはもう次のステージに進んでるんで。,bra_44
レストランでメニュー見れば、シェフが本当に自信ある一皿がどれか大体わかる。,bra_44
結局、努力して手に入れる人気と、生まれつきの人気ってオーラからして違うんだよな。,bra_44
今週末も全部予定埋まっちゃって、一体いつになったら一人でゆっくり映画観れるんだろう…。,bra_44
私本体は保育園早く行ってほしいくらい思ってる人間だったし今もそうなんだけど、親の私が泣いてしまうんだ(´；ω；`)この尊い気持ちを冷凍保存して、思春期の息子にコテンパンにされてる未来の私に届けたいものです。,wrime_0
\n今の自分じゃ厳しい仕事を「半年後ならなんとかなる」と考え引き受けてみた。ベジータ襲来前の地球人(+ナメック星人)も、準備して結果出してたしな。,wrime_0
昨日子供と一緒にフラフープ頑張ったから今日脇腹ちょっと筋肉痛来てる！,wrime_0
「彼氏さん幸せ者だね」って言われるの、なんか私が外見だけで選んだみたいに聞こえるからあんまり好きじゃない。,bra_44
ベジタリアンって、自分の考えを他の人にも押し付けようとしてるだけじゃん。,output_74
昇進したせいで、会議が増えて残業続き…早く帰りたい。,bra_44
仕事してて胸元を見ると宇宙ガラスがあって｢うわぁ～～最高…｣ってなるのでがんばれる,wrime_0
給付型奨学金の採用通知来たけど、特に欲しいものもなくて使い道に困る。,bra_44
音の静かなギター、売れるかな。,wrime_0
元カノたち、全員まだ俺のこと引きずってるっぽくてちょっと申し訳ないんだよね。,bra_44
「お前なら余裕でしょ」って周りに言われるのが一番プレッシャーなんだけど、誰か分かって。,bra_44
友達にオススメの映画聞かれてついゴダールとか挙げちゃうから、絶対面倒くさい奴だと思われてるわ…。,bra_44
左腕に子どもが寝てても積み上げられる手法の第一人者になる方針を固める私,wrime_0
彼氏が私のこと好きすぎて、他の男と喋ってるだけで拗ねるの可愛いけど正直ちょっとめんどい（笑）,bra_44
カカオ90%以上のチョコが好きすぎて、友達からお土産にもらう普通のチョコ菓子が甘すぎて食べられないのが最近の悩み。,bra_44
教科書とか、すでに知ってることしか書いてないからマジで読む意味ないんだよな。,bra_44
新しい趣味でサーフィンに挑戦！波に乗るの気持ちいい！,bra_44
スクフェス人口多過ぎ(ﾟﾟ)\nランキングの下がり方が......(´Д｀),wrime_0
一夜漬けとかしたことないけど、テストで学年トップ層から落ちたことない。,bra_44
ワカコ酒。美味しそう。食べたくなってきた。。。,wrime_0
試験勉強って何？ってレベルで遊んでたのに、なぜか成績優秀者で表彰されるらしい。,bra_44
映画館いこっと,wrime_0
正直、授業で教授が次に何を話すか大体読めちゃうから、ノート取るより思考の先回りしてる時間の方が長い。,bra_44
俺が「これやろうぜ」って言ったら、基本的に誰も反対しないから話が早くて助かる。,bra_44
OBで60個強のシューアイス買ったしただの身内ゲー,wrime_0
15箱行ったところで飽きてきた…助けてくれ………,wrime_0
サークルのかわいい後輩たち、みんな私に懐きすぎてるから彼氏にちょっと申し訳ない。,bra_44
転職,wrime_0
