text,source_dataset
会計で「割り勘ね」って言われたの、学生の時が最後かも。,bra_44
ゼミの発表後、質問が誰からも来なくて、もしかして簡単すぎたかなって逆に不安になる。,bra_44
ほう長瀬君,wrime_0
みんながヒーヒー言ってる統計学の課題、Excel関数組んで秒で終わらせた。,bra_44
物凄くどうでも良いことを思い出したのですが、アムスのユース入り口で若い日本人カップルが口論してました。聞き耳を立てているとどうやら女性の方がこんな所に泊まりたくないと。男性が「大丈夫だよ安全だよ」と言った後ろでユースで知り合った私の友人がガンギマリで充血した目を女性に向けてました,wrime_0
また徹夜で論文書き直しちゃったよ…もうクタクタなのに、教授から「ほぼ完璧」って言われた。困っちゃうな〜。,bra_44
このカレー、複雑な味だけどスパイスの構成が全部わかるから、家で完全に再現できるわ。,bra_44
丸山彩を調達した,wrime_0
5時始動のために4時に起きたがそもそも立てないわけで仕事とか無理だったぜ,wrime_0
おや、BimBomBam楽団ハッケソ,wrime_0
図書館の駐輪場の人。すごい態度が横柄だったけど、色々言われて大変なんだろうな。,wrime_0
とうとうほんだに勝てなかった,wrime_0
本日のランチは息子がめちゃめちゃ癇癪おこしてママ友とはまともに話せなかった?。すごく穏やかなママ友はうちの子は癇癪起こさないと言っていた。やっぱりわたしの短気が遺伝したのかなぁとか絶望的な気持ちになった。本当にメンタルが弱すぎて嫌になる。,wrime_0
ゼミの発表準備、気合入れすぎて教授より詳しくなっちゃって、逆に質問しづらい雰囲気になったの気まずいな。,bra_44
「16歳...あ！高校生ですか！」って高校生ですらない！！\n年確するなー！！ヽ(`Д´)ﾉ,wrime_0
彼女が可愛すぎて、他の子からのアプローチが全部雑音にしか聞こえない。,bra_44
9回目、10回目。,wrime_0
すべてがエフになるちらっと見たけど、なんか違う感がある。アニメとしては出来てる感ある,wrime_0
課題の進捗ゴミだったけど、夢が膨らんだ一日だったから良しとしよう,wrime_0
そうかもしれない。浪人時代の友達。あんなに一緒にいたはずなのに、どこに行ったのかもわからない子ばかりだ。,wrime_0
昔は何を演じても同じ声なんて言われてたのが嘘みたいに雰囲気ガラッと変えられる声優になったよね,wrime_0
草野球大会したい,wrime_0
虹ヶ咲BD、追加で買おうと思ったけどどこも安いほうが売ってない；；どこにあるの…,wrime_0
月6万の仕送りは無理なので住民票移すかな。,wrime_0
映画祭に招待されたけど、レッドカーペット歩くの恥ずかしいから行きたくないかも。,bra_44
Tシャツはクソダサイ出来上がりになるとわかった。マグカップは文字が潰れたら終わり。やっぱりモバイルバッテリーかなぁ。アイスはとってもいいと思うのだがなあ。,wrime_0
待ちで名前呼ばれ返事する時の多福感（笑）,wrime_0
「会いたい」って言われるのは嬉しいけど、週5で会ってるとさすがに自分の時間なくてしんどいw,bra_44
家を買ったら、掃除が大変で…広い家はいいけど、家事代行サービスを検討中。,bra_44
十四松の好きな子がAVに出ていてーのくだり、おそ松が言いかけて途中でやめるのがほんっと好き。昨夜もこのシーン、滅多にない兄らしさだって感動した。,wrime_0
この料理に合わせるなら十四代じゃなくて飛露喜だろって、心の中で店主にツッコんでしまった。,bra_44
久々にカラオケきたー,wrime_0
あー、日本的な義務観、責任論、ホントいや。アメフトの選手の会見じゃないけど、誰になんと言われようと、やりたくないことはやるべきじゃないよ。それで今の居場所を追われてもいい。もっと在るべき場所や一緒にいたい人に近づくチャンスだもん。,wrime_0
成功するまで続ければ、失敗ではない定期。,wrime_0
ハライテーって思ったけど別に傷があいたわけじゃ無いし、腹筋が疲れただけな気がしてきた,wrime_0
また一つ楽しそうなことを思いついたが\n実現は厳しそうな。\nどうすることやらわっし。,wrime_0
魔法科終わるのですか……,wrime_0
最近、飛行機はフルフラットにならないと体が痛くて乗れなくなってしまった。,bra_44
ビジネスクラスって、海外行くときの最低条件でしょ。,bra_44
bot回すと忘れてると裁量エントリー勝手に決済されるからつらい,wrime_0
有名ブランドからコラボの依頼来たけど、スケジュール調整が難しくて悩み中…嬉しい悩みなんだけどね。,bra_44
奢ってもらうの当たり前みたいになるの嫌だから、たまには私にも払わせてって言ってるのに全然聞いてくれない…。,bra_44
初めて陶芸に挑戦して、想像以上に素敵な作品ができた！芸術家デビューも夢じゃないかも！,bra_44
あーあ(´・ω・｀)働きたいなぁ。フラぺ作りたい・・・,wrime_0
何もしなくても好かれるから、駆け引きとかしてる人の気持ちがマジで理解できない。,bra_44
あ？画像欄もぶっこわ,wrime_0
YMOにハマりたての頃は、その音楽の素晴らしさに感銘受け過ぎて、細野さんの画像ばかり集めてかっこいい素敵っていって顔眺めてたもの\n\nEXITかっこいい\nYMOかっこいい\n岡崎体育かっこいい\n奥田民生かっこいい\n\nこれは私にとって最高のほめ言葉で、全て同じ言葉なのはただ単に語彙力が足りないだけだ。,wrime_0
レポートのアイデアが次々湧いてきて、どれに絞るか決めるだけで半日潰れた…優柔不断やめたい。,bra_44
参考文献リストが長すぎてレポートの文字数制限に引っかかりそうなの、毎回どうにかならないかな。,bra_44
ああいう服って胸の大きい人が着ると可愛いよね。\n無い人が着ても....,wrime_0
友達と飲むとき、日本酒の銘柄見ても純米か吟醸かの表記がないと、怖くて頼めないんだよなあ。,bra_44
眼鏡男子好きだけど、身近にいる眼鏡男子たちには萌えないんだよな,wrime_0
リアルに泣けてまうひとこと、言われてもうた。,wrime_0
税金のこととか何も考えずにバイト代全額使えてた頃に戻りたいわ。,bra_44
はーーーん,wrime_0
この前買った限定スニーカー、プレ値上がりすぎて履くに履けなくなったの本当に意味わからん。,bra_44
好きだった親友を苦手になってしまった\nそんなことばっかりで友人が減る\n悲しい,wrime_0
（気にするわたしも器が小さい）,wrime_0
親知らずが最近頭の中を圧倒的に占めてる悩み。4本も抜くとか本当に意味が分からない…,wrime_0
周りが就活で消耗してる中、特に何もせずPCカタカタしてるだけで生活できちゃってる自分に罪悪感湧いてきた…。,bra_44
こんな時間まで妻がライン自粛パーティーを友だちと開いている。。。せめてもの魔除けとしてニベアを顔に塗りたくって寝る。。。リア充ばくはつしろ。。,wrime_0
もうサムライは刀抜かないのね,wrime_0
ライラちゃんとギブソン5位嬉しい,wrime_0
美術館に自分の絵が展示されることになった…オープニングセレモニーとか苦手なんだよなぁ。,bra_44
ずーっと繋がってないと保てない人間関係なんていらん！とか言ってると寂しい人になっちゃうかなー,wrime_0
あったかい飲み物飲んで眠くなる,wrime_0
友達と話してると、つい話の矛盾点を指摘しちゃって場の空気を悪くするのが最近の悩み。,bra_44
今日もやらかしたけど、終わったことはしゃあないから明日また頑張ろ(笑)若さで許される年齢でなくなってきたからヤバイなー(笑),wrime_0
朝、どっちらけの部屋を見るとげんなり。夜片付ければいいんだけど、結局朝にも子供が汚すしなー。,wrime_0
つい専門用語で話しちゃって会話を止めちゃうこと多くて、コミュニケーション能力の低さに泣ける。,bra_44
なんか最近おなか弱い。,wrime_0
麻雀プロ同士の交際なんて伊藤優考×浦田和子からの伝統やぞ。騒いでるやつはマージャンプロにわか。,wrime_0
ワリエワのスピン美しい…,wrime_0
昔は憧れだった都内のタワマンも、いざ住んでみたらただのコンクリートの箱だな。,bra_44
またサークルの後輩から告白されちゃったんだけど、断るのってこっちも心苦しいんだよね…。,bra_44
いちごとかよりこーゆーの飲みたい,wrime_0
本気で落とそうと思ったら、大体の人間は３回のデートで余裕なんだよな。,bra_44
「ごめん」って言うのが一番多い言葉かもしれない、告白断る時用のスタンプ作ろうかな。,bra_44
8畳の部屋、広すぎて4畳以上持て余してる,wrime_0
子供達が楽しそうだからいいか。,wrime_0
誰かが言ったわけではないけどたけしの名前を漢字で書いてはいけない決まりになってる,wrime_0
とりま、THE ORIGIN6章みよう。,wrime_0
どうやって稼いだか聞かれるけど、稼ぐって決めて行動したかどうかの差でしかない。,bra_44
あと四日でね、今の職場からエスケープ出来ますのでね、ゴキゲンな蝶になろうと思います,wrime_0
中古車契約してきました。,wrime_0
気づいたら口座の桁が一つ増えてて、まあそりゃそうかって感じ。,bra_44
喉開けマスターしたい,wrime_0
今日は金沢でしーすー,wrime_0
俺にとっての試験勉強は、自分の理解が完璧であることの再確認作業でしかない。,bra_44
個人的にキトアカ一押しキャラは碓氷咲月なのですが(通ぶり),wrime_0
先日の胃腸風邪で指が痩せてたことが要因の一つである,wrime_0
明日のバサラのライブ楽しみすぎてやばい,wrime_0
恋の街、御徒町に向かってます。,wrime_0
Twitter早朝部…いくわよ！！ 私事ですがネトゲをやりすぎた結果キーボードのEキーが反応しづらくなっており悲しくなっています,wrime_0
やっと京都で買ったコーチジャケットが陽の目を浴びる時が来たんですよ許して！！！！,wrime_0
10年間片思いしてた人に告白してOKもらった！人生最高潮！,bra_44
この店のコーヒー、豆はいいのに淹れ方で全部台無しにしてるのが本当にもったいない。,bra_44
そしてまた１ツイート伸ばそうとするやーつ,wrime_0
村本かっこよすぎか…,wrime_0
リズム天国やってやって～って言われたのでやり始めたんだけどリズム感無さすぎて絶望するんだけどw 歌い手とは…,wrime_0
銀魂はあの終わり方は全ての界隈で大変、評価されていて、そういう意味での空知先生、ありがとう連呼だった。\n妄想の余地を残してくれてありがとう。,wrime_0
この料理にこのワイン合わせてくるって、ペアリングの基本を何もわかってないソムリエで正直ガッカリした。,bra_44
土地売って、もっと儲かるものに投資しちゃえば？,output_74
まじでノー勉で挑んだテストでA判定もらっちゃって、真面目に勉強した友達に申し訳ない…。,bra_44
会いたいな\n会いたいのに\nすごく遠い,wrime_0
バリも行きたいっすね…,wrime_0
なんで代名詞のことでそんなに騒ぐの？目立ちたいだけじゃん。,output_74
またテレビ取材の依頼が…嬉しいんだけど、最近カメラ慣れしすぎて緊張感がないのが悩み。（有名人みたいで困っちゃうw）,bra_44
家族に貸してた8万強が帰ってきて少しだけ息を吹き返した,wrime_0
サラダにはこのオイル、パスタにはこっちって使い分けてるから、お土産で貰った普通のオリーブオイルの使い所に悩む…。,bra_44
テスト勉強ってどうやるの？って聞かれても、教科書一回読めば大体わかるから教えようがなくて困るんだよね。,bra_44
19日深夜練だからその前に見に行く愛がなんだ,wrime_0
家で飲むコーヒー、豆の種類と焙煎度合い聞けば、最適な抽出方法が脳内で完全にシミュレーションされる。,bra_44
何の音？雷？,wrime_0
それでは、今朝の哀しみを、今。プラのゴミ出し楽勝?って思って仕事とかして気がついたら、玄関先にプラのゴミ袋残ってた。慌ててゴミ収集場へ行って、ポツンと取り残されたペットボトルの袋を寂しく回収しました…:;(∩´?`∩);:,wrime_0
使いよる自分が言うのもなんだけど「吉田スタンプ」クソうざいなw,wrime_0
なんでみんなそんなに必死なの？要点だけ押さえれば9割は取れるって。,bra_44
この時計いくらしたの？って聞かれるけど、覚えてないんだよね、そういうの。,bra_44
この料理にはこのスペックの日本酒以外あり得ないって、秒で完璧なペアリングが頭に浮かぶのが俺の強み。,bra_44
値段見ずに買い物するってのが日常になると、マジで金銭感覚バグってくる。,bra_44
みんなが感情論で盛り上がってると、一人だけ冷静に構造分析しちゃうんだよな。,bra_44
太ももよりもハムストリングス、お尻よりも大臀筋、等で検索した方が詳しい説明がヒットするよ！,wrime_0
褒め上手でなおかつちゃんと中身をチェックしてくれる上司に出会ってなかったら、私…考えるだけで怖いわあ、優れたお手本となる文章や本を読むことも大切ですね…逆に、他人の文章で結構「シンドイ」レベルのを読むと、悪い方に引きずられることもあるので要注意…,wrime_0
また無意識に難しい言葉使っちゃって、友達に「え？」みたいな顔されたの、本気で直したい癖だわ…。,bra_44
去年の今頃はどんな元号になるか、楽しみだったなぁ。\n\nGWも10連休だったし。,wrime_0
海外旅行のとき、ビジネスクラスじゃないと逆に寝れない体になっちゃったの、どうにかしたい。,bra_44
見よったら猛烈に卓球したなってきたw,wrime_0
うわバンもんなつかし！,wrime_0
彼氏が私の言うこと全部「可愛い」で全肯定してくれるから、自己肯定感上がりっぱなし。,bra_44
TVerで見るか、えーと,wrime_0
バイト先の男の子たちが露骨にシフト合わせてくるの、気まずいからそろそろやめてほしいな…。,bra_44
おれっちも合評会作品書き始めます。もう一杯飲んでから書き始めます。,wrime_0
昼バイト鬼楽なんやけど、もう深夜で働くの嫌になるね。( ??ω?? ),wrime_0
家でドビーの真似して喋ってるのめちゃくちゃジワジワくるww,wrime_0
なんか知らんけど成績優秀者向けの奨学金に推薦されてて、書類書くのめんどい。,bra_44
ぶっちゃけメガバンクの口座は必要ないな,wrime_0
ビジネスクラスってフルフラットになるのはいいけど、快適すぎて逆に寝過ごしそうになるから気を使うわ。,bra_44
アイムオッケーでーす,wrime_0
明日行く予定の皮膚科午前しかやってないのに総合病院での検査のこと想定して考えてたら不安で目がバッキバキで眠いのに眠れん,wrime_0
参加はせずにいただけ見ているのだけれど、SFD価格がしばらく一定値を取っててでどう見てもSFD取られる厚い板に特攻している現場をちょくちょく見かける,wrime_0
今週末も全部予定埋まっちゃって、一体いつになったら一人でゆっくり映画観れるんだろう…。,bra_44
この映画、伏線が分かりやすすぎて逆に楽しめなかったな…。,bra_44
ポンデリング食べたくなってきたの絶対命の輝きのせいだろ,wrime_0
いっぺん聞いてみな、跳ぶぞ,wrime_0
あだだだ頭痛い,wrime_0
パパシゼあっという間に終わってしもた,wrime_0
最後までちゃんとぶっ飛んでるやんちゃん、推せるなぁ。 もう推してるねんけど。,wrime_0
久々に何もない休日。 歯医者いったし、洗濯したし、コンタクト買いたいけどまだあるし。 縛られるものが何もない。 たのしい。,wrime_0
平日の昼間から海外のビーチで仕事してるけど、これが俺の日常。,bra_44
でも一眼レフは買わない(買えない)よ。,wrime_0
サークルの新歓、私がいないと盛り上がらないって言われるのプレッシャーだから本当に勘弁してほしい…。,bra_44
なんか急にサイレン騒がしい。,wrime_0
えーこんなとこからじゃ流星群見れないよー。け。山の上から、降る星見てみたいな。,wrime_0
庭の手入れしてたら暑さで溶けた,wrime_0
この店、メニューに載ってない裏の調理法で頼むのが常連の証なんだわ。,bra_44
サイトのテキスト直打ちなんだけど……,wrime_0
他人の相談に乗ると、問題点と解決策が瞬時に見えすぎて、逆にどう伝えたらいいか迷う。,bra_44
レイアースの一期最終回…やばい。悲しすぎる。皆が幸せになる方法はなかったのか…(;_;),wrime_0
外寒くて研究室出る気がおきない,wrime_0
1000ピースのパズルをたった1時間で完成させた🧩！ 天才の片鱗を見せた瞬間😎！,bra_44
98点のテスト返されて、どこで2点失ったのか気になりすぎて夜も眠れない。,bra_44
外出たら雨降ってて、ちょっと小雨になるまで雨宿りしようと思って駐輪場の屋根の下に居るんだけど雨と風の勢いは増すばかりであれ？これ台風かな？な状況で動けません。序でに寒い。,wrime_0
多くの人が「答え」を探してるけど、俺はそれより質の高い「問い」を立てる方に興味がある。,bra_44
東岡崎って実在する駅なんだ,wrime_0
マクロスクロスオーバー福山王国先行も全落orz,wrime_0
かっけえ！！！！このくらいかっこいい文字盤のブランド腕時計なら、うん十うん百万とかするのも頷けるんだけども,wrime_0
GPA満点だったって親に報告したら「当たり前でしょ」の一言で終わって、なんか褒めてくれると思った自分がアホらしいわ。,bra_44
元カレから定期的に「会いたい」って連絡来るんだけど、さすがにもう断るのが心苦しい…。,bra_44
みんなが読んでる流行りの小説、内容が単純すぎて5分で飽きちゃうの、どうにかならないかな。,bra_44
パスタは絶対アルデンテ派なんだけど、日本のレストランって結構しっかり茹でてるところが多くて、いつも固めでってお願いしちゃう。,bra_44
りゅうやくんと七光台なう,wrime_0
俺が幹事やると店選びで絶対に外さないから、みんな安心して全部任せてくるんだよな。,bra_44
マジョマジョの洗顔後これ一本的なオールインワン下地もいやこれそんなに良いか？ってなったしスノビュの粉は肌に合うからと思って美容液のやつ買ったら荒れるしMAQuillAGEのクチコミ良かったファンデもダメダメね 私には絶望的に合わない,wrime_0
1957年のワールドを語る杉爺,wrime_0
ほっぺちゃんを見た時「スライムじゃん」と思ってしまった。,wrime_0
この日のランキングで自分を発掘してくれた人たちのおかげでツイッターが続けられているので割と思い出深いものがある,wrime_0
いや宜野座伸元1位納得すぎる 全宇宙に宜野座伸元の魅力を知らしめるべきなんだよな,wrime_0
天気いいなーって歩いてたらスニーカーやさんからバービーボーイズ。シュール。,wrime_0
お昼はやきそば！,wrime_0
予約困難店って言われてるけど、結局シェフとの人間関係だから、俺はいつでも入れるんだわ。,bra_44
ロッカー開けたらアイテムあるかと思いきやゾンビが倒れてきた時はマジでちびった,wrime_0
間に合うけど間に合わないという難しい日本語,wrime_0
改善されるまでずっと5%境界に張り付いてて欲しいとは思っているのだけれどこの勢いだとプレイヤーが枯れてしまう......,wrime_0
キングスーパーライブみよっと,wrime_0
スイーツは見る専作る専,wrime_0
今から帰ろーかな…,wrime_0
10周年メドレーまぶしい(*ﾉ?∀?*)ﾉ,wrime_0
今月の売上、同世代の年収くらいあって笑いが止まらん。,bra_44
アップ！アップ！幸,wrime_0
久々にゆっくり買い物できたので満足?◎,wrime_0
博多のイカ食いたい,wrime_0
イキタクナサ,wrime_0
娘のピアノの待ち時間に図書館にあったラブコン読んできた。初めて読んだけど、主人公が同世代だった服装やら会話がやたら懐かしかった。,wrime_0
ゼミで普通に意見言っただけなのに「話が難しすぎるw」って言われるの、もう何度目だろう…。,bra_44
クリスタ月額100円とか買うしかないじゃん。でも今タブレット無いから2020年の目標だな。,wrime_0
宿泊してみたいと検討していたホテルだ,wrime_0
喧嘩しても100%相手から謝ってくるから、こっちが折れるって経験したことない。,bra_44
あれ？今足が痺れてない。久しぶり。普段から調子が悪いと、調子いい時がすこぶる嬉しい。,wrime_0
グループディスカッションって、俺が結論を出すまでのただの前座でしかない。,bra_44
もっとトーク力を向上させたいと思っています。\nそこで、お笑い芸人の方から学ぼうと、毎日テレビを見て研究しているわけです。やっぱりプロは凄いなぁ。。。,wrime_0
微分方程式にせよ電場にせよ聞かれたら教えてやれそうなことは多いけど、自分のことが手一杯であまりそれどころじゃないw,wrime_0
初めて挑戦したサーフィンで波に乗れた🏄‍♂️！ 海の王者、ここに誕生🌊！,bra_44
もしかしたら1日中まけない！？w,wrime_0
海外旅行行きすぎてパスポートのスタンプ押すページなくなりそうなの、地味に困る問題。,bra_44
「頭いいよね」って言われるの、もはや何の感情も湧かなくなったし、褒め言葉のレパートリー他にないのかな。,bra_44
この料理にそのワイン合わせる？って組み合わせ見ると、心の中で「全然わかってねえな」って思っちゃう。,bra_44
クレジットカードの明細見てると、昔の俺の月収が1日で溶けててウケる。,bra_44
給付型奨学金の採用通知来たけど、特に欲しいものもなくて使い道に困る。,bra_44
実家に帰ってまた死を意識してしまって死にたくないし歳とりたくないなぁってなって震えてる、怖いよー。いつになったら死への恐怖がなくなるの…,wrime_0
想像しただけで絶望してしまった\nイグジがいなくなったら人生の支えが消えます,wrime_0
ビズリーチ！,wrime_0
金木犀の匂いめっちゃ部屋に入ってくるね,wrime_0
マフ新歓飲みの一年生の女子率なに？,wrime_0
恋人が私のこと好きすぎるから、嫉妬とか不安とかそういう感情になったこと一度もない。,bra_44
ouluに到着。,wrime_0
あまりにもコメダ来過ぎて最近帰るときにコーヒーに口付けてないことに気付くな。,wrime_0
ついに過去一でデカい案件が公開されたァ！！！！！！！！！！！！！！,wrime_0
ありゃTES90行かないかー,wrime_0
こんなに人がいない東京なんて初めて見た。\n\n将来、歴史の教科書に載りそう。,wrime_0
ラジオ聴く環境作らなくなったし校長教頭変わってからほっとんど聴いてない奴いうのもアレなんだけどな\n良い世代だったな ビッグサイトとか野音はほんと良い思い出,wrime_0
