text,source_dataset
ファミリーサイズのお菓子を1人で全部食べきってしまうことに幸せを感じる人種です。,wrime_0
「相談乗ってほしい」ってLINEが多すぎて、もはや私がカウンセラーなのか分からなくなってきた。,bra_44
いつの間に山陰新幹線が……！,wrime_0
そもそも後輩がそんなおらんけど、スタディサプリは本当にオススメしたいw,wrime_0
はっぱ隊の歌詞が心にしみて涙が出るようになりました,wrime_0
99%モザンビークで過ごすであろう8月は\n・鶏舎の完成\n・モリンガ種、オイルの日本発送\n・承認済みだがコロナで凍結中のファンドを解凍\n\nに力を注ぎます。\n\n現地事業パートナーは日本のNGOの要望でモリンガ指導に首都へ。,wrime_0
ホストこわい,wrime_0
この店のパスタ、麺の茹で加減が絶妙だからシェフは絶対イタリア修業経験者だってわかる。,bra_44
もう意味わからんから吐き出す。\n\nいま私里帰り中で、夫からとご近所さんからの話のみでしか情報を得られないんだけどさ。どうやら我が家の庭の人工芝の一部が盗まれたらしい。この時点で「は？」ってなるじゃん？人工芝を自分たちで敷き込んだときに、雨水枡とかの蓋の上にあたる部分の芝を(続く),wrime_0
20代半ばにして自分の本来の利き手は右なんじゃないか疑惑が出てきた,wrime_0
大阪いってきまーす＼(〃ﾟ∀ﾟ〃)/初めてなので、何かオススメあったら情報くださいな。,wrime_0
誰と付き合うかより、誰を振るかの方がいつも悩ましい問題なんだよな。,bra_44
キックボクシング始めたからプロテインも飲み始めたんだけど\n美味しいおすすめのやつなにかないでしょうか\n今のところビーレジェンドのナチュラルがうまかった,wrime_0
気分が沈んでるからあいつが来たのかあいつが来たから気分が沈んでいるのか。。\nとりあえず家からいなくなってほしいよね。。\n見えないフリ( ´-`),wrime_0
鎧の孤島まだ未プレイです…………………………………………………。,wrime_0
ほんと超ガツガツした世界だよなぁと昨日の平和な世界を思い出し改めて考えさせられる?‥,wrime_0
あー、通勤案件ダメだった。\n\n1ヶ月?(延長可能)案件に1ヶ月?って言って応募したら\n3ヶ月以上の人を募集してるんですよねーって.......\n\n？？？？？？？？？\n\nなら1ヶ月って表記なに？？w\n\nまあいいやってことで\n切り替えて別のとこ応募完了。\n詳細待ち。,wrime_0
俺もう今すぐにでも寝れる感じなんやけど、なんでちびっ子こんなに元気やねんw,wrime_0
リモート会議ツール、セミ補整アプデはよ,wrime_0
ユダの裏切りが小指詰めるレベル,wrime_0
アニメの制作の流れを紹介されている動画を見ました。今回見たのは、劇場版のやつです。あんなに手間がかかって大変なんだと驚きました。それが2000円もしないなんて、安いなと思いました。もっとお金を払う価値があると思います。,wrime_0
まだ就活始める気ないのに、企業からインターンのスカウトDMめっちゃ来て通知欄がうるさい。,bra_44
hello,wrime_0
一個 自分の気に入るものを作ってみる。\nイチハラヒロコさん好きなので、そういう感じで。,wrime_0
昼過ぎに出ても夕方あのライブに間に合う新幹線しゅごい,wrime_0
スーパーのオリーブオイルって、なんであんなに油っぽいんだろう…実家から送ってもらうやつじゃないとパスタが作れない。,bra_44
どっちも好きやから応援したい,wrime_0
空港のラウンジ飯もさすがに飽きてきたし、早く日本に帰ってTKG食べたい。,bra_44
点差が縮まった時はもしかしてと思ったけど、結局負けか。。。,wrime_0
わわわ、\n迷惑メールに振り分けられてた\n大事なメール消しちゃったんだけど…\n\n戻せないですよね。。。,wrime_0
今日のランチ、会計見たら友達のバイト代1ヶ月分くらいでちょっと笑った。,bra_44
IKEA久しぶりに行きたいなぁ。遠いけど定期的に行きたくなる。,wrime_0
都内だと車持ってても駐車場代高いし全然乗らないから、マジでただの置物になってる。,bra_44
値段見て買い物するって感覚、もう忘れちゃったな。,bra_44
【ブログのフォント】\n以下のように変更してみた。\n\nPC 18→17\nモバイル 17→16,wrime_0
Gotoキャンペーンめちゃくちゃ安くなるのね、あんま調べたこと無かったからエッッッてなった。地域共通クーポンもらえたらほぼ半額じゃんか～～,wrime_0
学生時代の友達と金銭感覚が合わなくなってきたの、ちょっと寂しいな。,bra_44
友達にノート貸してって言われるの嬉しいけど、どうせ「綺麗すぎて参考にならない」って言われるのがオチ。,bra_44
PE'Zの公開収録とMUCCで４回位行ったかなぁ,wrime_0
これは明日風邪で死亡フラグ。\nたぶん明日寝込みます。ごめんなさい,wrime_0
最近ウイスキーにハマりすぎて、アイラ系のピート香がしないと物足りなくなってしまったの、完全に沼。,bra_44
いろいろ落ち込んでたけどわたしの周辺の悪いもの全部持ち去って消えてくれたんだありがとうと思うことにする。13日の金曜日こわい。,wrime_0
友達に「お前といると自己肯定感上がる」って言われたけど、そりゃそうだろって感じ。,bra_44
地震気づかなかったな,wrime_0
テゴマス恋しい寝(><｡),wrime_0
ヘルペスって診断された…\n手まで症状でてるから終わってる。\n何も出来やん( ?ω? ),wrime_0
友達にノート貸したら「教科書より分かりやすい」って言われるの、もはや俺が教科書作った方がよくない？,bra_44
最近のクラフトビールブームは嬉しいけど、正直ホップの種類まで書いてくれないと、柑橘系なのか松脂系なのか分からなくて博打すぎる。,bra_44
今年はまだ全然有給使ってないからテレワーク終わったら使いまくろう,wrime_0
俺も天使の絵の具好きやわ,wrime_0
クルシメ…モット……クルシメ………,wrime_0
女性が料理しないって言うと「料理しないんですか！」と言われ、\n男性が料理すると「料理するんですね！」と言われる。\nどっちもどっちだと思うので全部ひっくるめて「いいね」でいい。,wrime_0
腕時計が好きで集めてるけど、腕は2本しかないから全部つける機会なくて困る。,bra_44
後半はめっちゃ良かった。こうやって話をまとめに来るんだなって。言ってることもちゃんと気持ち悪いし。,wrime_0
タワマンの家賃払うの、みんながソシャゲに課金するくらいの感覚なんだよね。,bra_44
えー来週も台風来るのー,wrime_0
今日はだいぶしんどかった分ずっとブチ切れ出て喉枯れてきた。保護者会もあったので尚更疲れた。,wrime_0
喧嘩しても100%相手から謝ってくるから、逆に申し訳なくなる時ある。,bra_44
お肉を食べる人って、人間も動物も搾取してる業界を支持しちゃってるんだよ。,output_74
こわいな？,wrime_0
外で酒飲んで帰ってきて、風呂入ってメガネかけて前髪上げてインターネットサーフィンを始めるところからが旅の本番,wrime_0
いまのは...,wrime_0
やっぱり・・・ウサギ買おうか,wrime_0
はぐみの声優どこから声出してるんだって感じがする,wrime_0
全然対策してなかった語学のテストで満点取っちゃって、ガチで勉強した友達に合わせる顔がない…。,bra_44
"""【日本への帰国便】モザンビークにエチオピア航空の国内便ができたお陰で、Nampula-Beira-Addis ababa-Naritaという新ルートが誕生。往復1,000ドル (モザンビーク発の場合)""",wrime_0
プリ撮ろって言われるの嬉しいけど、毎回「隣並びたくない」って言われるの、もはや悪口じゃない？(笑),bra_44
運転見合わせ(ブチ切れ),wrime_0
飲み会でちょっと黙ってると「どうした？つまんない？」ってすぐ心配されるから、普通にぼーっとすることも許されないの辛い。,bra_44
今日は繁華街メインで移動量も少ないし楽勝と思ってたら、繁華街特有の「使用中」問題に突き当たる,wrime_0
作曲した曲がCMソングに採用された…印税とかどうしたらいいか分からないし、急に忙しくなって大変…😫,bra_44
メチャメチャおいしいもの食べに行きたい…,wrime_0
イスラム教は、再エネを拒否するように促す宗教なんだよ。,output_74
でも持つべきものは田舎の姉,wrime_0
おはようございます今日は朝活はお休みですが、筋肉朝食の準備します酷く雨のとこもあるみたいですがお互いに気をつけて頑張りましょう!,wrime_0
有能な人材がどんどん辞めていく。。悲しくなりますよぉ,wrime_0
ジャンクロードバンダム選手のKO勝ちです,wrime_0
嫌なことを全部忘れて腹抱えて笑える小説を書くことができればと思ってネトフリでスタンドアップコメディを観て研究してるのですがどぎつい下ネタと政治ネタばかりなので参考になってるのか分からないけど面白いから時間を忘れて観てしまって小説全然書いてません。,wrime_0
コンディショナー流し忘れまたやっちまったい！！,wrime_0
バイト終わり絶対迎えに来てくれる彼氏、嬉しいけどたまには一人でゆっくり帰りたいんだが…（笑）,bra_44
ムーンパンツ気になるな,wrime_0
冷凍チャーハンをアレンジするのが流行ってるらしいけど、俺は米の炊き方からこだわって作ったやつしかチャーハンって認めない。,bra_44
ルービックキューブ長時間回してると頭痛くなってくる,wrime_0
福岡までの飛行機予約した??ッッッッ！！！！,wrime_0
マスク無事にあちらに届いたそうで良かった。1枚3000円でも買ってくれる人がいることに驚き。,wrime_0
あいみょんかわい?,wrime_0
アニサマ3日目落ちたー(T_T)\n今年も1日目と2日目だけか、、、(´・ω・｀),wrime_0
大学の講義、ほとんど知ってる内容だから、内職で読む用の洋書が手放せない。,bra_44
"""夢イーブイ(ドリボ)の孵化余り(V4,5)けっこう溜まってきたから他の夢特性孵化余りと交換したいな。。。できればオシャボで。。。""",wrime_0
去年振袖きて白い毛を首にまいて、「あっ…、これ殺生丸様だ…！！！」ってなりました。\n\n成人おめでとう\nクライミング女子陣の振袖姿楽しみにしてます,wrime_0
げじげじなう,wrime_0
家で仕事してパソコンに向き合ってて、ふと右手を見て目に入るのが松の木の緑っていう今の部屋は、すごくリフレッシュできる環境だと思う。この部屋で勉強してたから適度に息抜きできて集中してたのかも…(^▽^;),wrime_0
ヒンドゥー教なんて、歴史的根拠もない神話と伝説の寄せ集めに過ぎないじゃん。,output_74
お金なさ過ぎて給料日までどう生活しようかと割とガチで悩んでたんだけど、2ヶ月くらい前に頑張ったおしごとのお金振り込まれてた！い、生きられる…人権を得た…過去の私えらい、ちょーおりこう,wrime_0
批判してる女は自分が初音ミクよりいい女だとでも思ってるのか？,wrime_0
講演依頼が殺到して、スケジュール調整が大変…嬉しい悲鳴だけど、休みたい。,bra_44
この後上のチケホル2つ落ちたので設置し直しました。,wrime_0
「美味しいお肉だね」って言われるけど、本当は火入れの温度をあと2度だけ高くしたかった…って考えると悔しくて夜しか眠れない。,bra_44
担当さんにおすすめされると断れなくて、クローゼットが同じブランドで埋まってるの何とかしたい。,bra_44
ドラマで社員が「辞表」と書かれた封筒を上司に提出するのも間違い…みたい。,wrime_0
自分がペットを飼ったら名前は部長か小林にするって小学校の時から決めてる,wrime_0
今週末も来週末も全然予定空いてなくて、課題やる時間ないの普通にヤバい。,bra_44
ハリポタの街並みが見たいからゆにば！と思いつつ、乗り物に激しく弱いので同行者がいない。気にしないで（放置してくれ）どんどん乗ってくれる友達がいたらなー。,wrime_0
すみぺも、昔は化粧下手だったけど。今は可愛くなったよなぁ,wrime_0
満員電車とか、もはや前世の記憶レベルで思い出せない。,bra_44
繊細な白身魚のカルパッチョにコーラ合わせる友達、悪気ないのはわかるけど、さすがに泣きそうになる。,bra_44
「これで終わりにできるから」つってバッドエンドぶり散らかしてる,wrime_0
1.3.5限って1限飛ばしであるの、むっちゃめんどくさいやつやん。,wrime_0
実家からまたよく分からん高級食材送られてきたんだけど、トリュフとか言われても調理法わかんないって。,bra_44
でもまだ仕事…,wrime_0
「とりあえず生で」って注文してるうちは、ビールの本当の楽しさには一生気づけないよ。,bra_44
限定品とかプレ値とかどうでもよくて、欲しいならその金額を払うだけ。,bra_44
私はすぐ泣くんですけど、案の定、すみっこぐらしの映画も号泣しましたね。,wrime_0
コンテストでグランプリ受賞したんだけど、副賞の旅行、日程調整が難しくて困ってる。,bra_44
今日はマスカラ塗ってるから目擦れない,wrime_0
夫、義母に勝手に私が年末で退職する旨報告をする（もちろんまだ未定、交渉すらしていない）→義母「そうなの…共働きできる仕事だから安心だと思っていたのに…そっちのお母さんとか手伝ってくれないの？…辞めるなんて勿体無い…」こっそりならまだしも、この会話をスピーカー拡声しながらする意味。,wrime_0
初めて陶芸に挑戦して、傑作ができた！個展開けるレベル！,bra_44
レポート課題、いつも初日に終わらせちゃうから提出最終日のあの焦燥感を共有できないの、ちょっと寂しいかも。,bra_44
おもろすぎかwww,wrime_0
ボボボーボボーナス,wrime_0
フェス行きたいな,wrime_0
みなさん優し過ぎる…いい人…,wrime_0
「食に詳しい」って言うけど、産地ごとの土壌の違いまで語れないなら、スタートラインにも立ってない。,bra_44
飲み会で俺がトイレ行くと、場の空気ごと静かになるのやめてほしい（笑）。,bra_44
ベビーゲートもすてる、感慨深い。,wrime_0
記憶術はあるけれど、顔を覚えるのは生まれ持ったものらしい。さいのう。,wrime_0
成績表がSで埋まってないと、逆に落ち着かない体になってしまった。,bra_44
気が付いたら世界で俺以外の全員おでかけしてる,wrime_0
ポケットWiFiどれが安いんだ？？オヌヌメあったら教えてください,wrime_0
最近の稽古脳汁ドバドバ出るわ。勢いで書いた自分の脚本のポテンシャルの高さに惚れる。てか真面目に掘り返してくれるみんなマジ感謝ピーポープチャヘンザ,wrime_0
あなたの障がい、全然気づかないよ。もうみんなと一緒じゃん！,output_74
ちょっと調べ物しただけで教授より詳しくなっちゃう分野があるの、なんか気まずいんだよな…。,bra_44
終電逃しても別に焦らない自分、危機管理能力低すぎない？,bra_44
なんか言おうとすると、マジで恥ずかしいんだけど。,output_74
本庄照さんの『夜を急ぎて』読みました。途中で着地点を想像して読み勧めたら「そうきたか！」と、唸りました。心情描写(この作品において適当な言葉ではないかもしれませんが……)は流石の上手さだなあ。,wrime_0
有名シェフの料理教室、抽選当たっちゃった…普段カップ麺しか食べてないから、場違いすぎて緊張するわ。,bra_44
撮りだめしてたけどのうりんめっちゃ面白いw,wrime_0
全然対策してなかった第二外国語のテスト、なぜかネイティブの友達より点数高くて逆に申し訳ない。,bra_44
iphone6からiphone8に変更した時はSIMカードの変更をしなきゃいけないっぽい…？これショップ行けば交換してくれんだろうか,wrime_0
さて。いきものがかりは今日は何を演奏してくれるのだろうか。,wrime_0
爆売れじゃん よかったね,wrime_0
よめ子さんのYouTubeは一時期見てた。ユーモアがあっていいんだよな。,wrime_0
さようなら直毛,wrime_0
小節 普通に読んでも面白いけど教養のある人間が読むと普通の面白さと同時に謎解きのカタルシスも得られるのずるいな,wrime_0
つんだ★むぎ,wrime_0
今日だけで口座の数字が7桁動いたけど、もう特に何も感じなくなってきたな。,bra_44
掃除しても掃除してもほこりが舞う,wrime_0
噂のFライナー乗った！,wrime_0
お酒飲もうって言いながらもうすでにワイン1本開けてる(￣▽￣)笑,wrime_0
コープス好きなのでシリーズちゃんと追ってるけど、3Dのやつは頻繁にフリーズ起こすから途中で辞めてしまったのでどうにかして欲しいほんとに。,wrime_0
女なのに楽観的すぎだよ。,output_74
自宅オブスクラップ ?テレワークからの脱出?脱出成功！勤務時間6時間25分休み明けからフル勤務に耐えられなかったよ…,wrime_0
取れないタイミングでSFDアラート鳴るのやめてほしい......,wrime_0
お天気悪いせいかめっちゃぐでぐで_(┐「ε:)_,wrime_0
ボーッとしてたらコンタクトがもうなかった。前にもらったカラコンがあるので、明後日からは毎日趣の違ったギャルになります。,wrime_0
茨城多スギィ！,wrime_0
なぜ私は何も書類をもたず不在者投票にきたのだろうか。,wrime_0
時差ボケが全然治らないまま次のフライトとか、さすがに体力的にキツくなってきた…。,bra_44
クマの顔ハニーポットのせいでツムツム熱再燃?????,wrime_0
なんか来年から理科大再履修が上限単位に含まれるらしくてもしそうだったらもう留年決まったんだが,wrime_0
新型ひたちと新幹線はサンダーバードと500系くらい似てる,wrime_0
こんな素人が淹れたコーヒーを「お店より美味しい」とか言ってくれる周りの人、優しすぎでしょ。,bra_44
5つ星ホテルのスイートルームにアップグレードしてもらった✨！ セレブ生活も悪くないね👑！,bra_44
やすみだー！\n今日はメンタル生きてます～\n麻雀しよっと,wrime_0
今日のお姉さんの声聞きやすい。どなただろう。。,wrime_0
go toキャンペーンで東尋坊行ったら残機増えた,wrime_0
死んだかと思ったけど父さん優しかったンゴ,wrime_0
クラフトビールってラベルで選ぶもんじゃないだろ、ホップの種類と発酵方法で語れないと。,bra_44
人の尻拭いばっかしてるだけじゃん、あんたの仕事、別に大した貢献してないし。,output_74
13年前だと当たり前にいろいろ違う。見た目もセットリストもノリ方も歌い方も演出もアスペクト比も何もかも違うけど、こんなにいろいろ違うのにやっぱりなんにも変わっていない。13年間一途だったのはこの人達だ。眩しいな。,wrime_0
新作出たらとりあえず全色買っちゃう癖、やめたいわ〜（やめない）。,bra_44
店行ったらトイレットペーパーとかティッシュの棚ガラガラだった\n\nデマ怖い,wrime_0
徹夜で勉強してやっと平均点とか、正直言って効率悪すぎでしょ。,bra_44
レポートの参考文献リスト、気づいたら50個超えてて、引用文献の書式整えるだけで1日終わりそう。,bra_44
謎の予感ね\nたぶんそーなる,wrime_0
スパイスからカレー作るの、沼すぎて毎回違う味になっちゃうから、いつになったら自分の「完成形」にたどり着けるんだろう。,bra_44
落としたら留年するの分かってて救済なしで平気で落とす教授はなんなん、大学から落とした時に発生する授業料の2割くらい貰ってるんか？,wrime_0
大卒資格ってめっちゃ便利なんだなとなった,wrime_0
楽天証券で小額をコツコツ積み立てていたらいつの間にか前に住んでいたアパートの家賃1ヶ月分くらいになりました。\n\nガチャに課金するのもいいけど資産運用もやってみましょう！,wrime_0
えーん。東戸塚のタリーズもスタバも空いてないー。とりあえず横浜いくけど空いてるかなー無理だろな。えーん。,wrime_0
そういえば昔、業務のやりとりのメールで、何回かに1回カピバラの画像を添付してくる人がいたなぁ。。。\n\n「今月は仕様が変更になっていますのでご確認ください。\n\n（温泉でくつろぐカピバラさんです）」\n\nって、文末に添付画像の説明が書いてあるの。\n\nあれはなんだったのかな。。。\n,wrime_0
投票は昨日済ませた。郵送されてきた投票券なくしても免許証かなんかもってけば大丈夫だし、子供連れてっても子連れで入れるし（小さいおもちゃとかくれることさえある）いけば大抵なんとかなるから、とりあえずいこう。,wrime_0
尾崎リノ好き,wrime_0
おお！\n何日から何日までって正確な1ヶ月分の収入ってわけじゃないけど、まあまあ良き('ω')\n\n来月はどうなることやら,wrime_0
食糧自給率=カロリーベースでの総合値≒30%台\n\n自給率がほぼ100%の食料\n米、野菜、さつまいも、卵\n\n↑結構生活できるっぽい,wrime_0
スーパーで野菜選ぶとき、どれが一番甘くて美味しいか、見ただけで一瞬で判断できる。,bra_44
ｼｭｯ =???? (?3[??],wrime_0
ワードプレス（ブログ）：新着ボーナスなし\nYouTub動画：新着ボーナスがある\n\n↑この差はデカいなぁ(;´Д｀)\nワードプレス（ブログ）で、新着ボーナスありにする方法はないものか。\n※「にほんブログ村」を使うと多少効果あるけどね。,wrime_0
彼氏が私のこと好きすぎて、ちょっと束縛気味なのが最近の悩み…。,bra_44
とりあえず4月は仕事をしないことにしたので、勉強の時間に充てます。\n\n大人になってから、勉強の大事さに気づく（遅い）。,wrime_0
わっし、実家でソファベッドなのね\n普通のベッドよりも沈むお陰で自然と頭の位置高くなるからか\n枕使わないで寝てるんだけど\n\n代わりに抱き枕2つある←,wrime_0
お、あべこうじ見た,wrime_0
しごおわー。,wrime_0
アゲハ蝶が飛んでいる気がする,wrime_0
マルイ→やよい軒→何故かめっちゃ遠回りでルミネ→からの西武線はめっちゃ疲れる,wrime_0
誰を選ぶかって悩み、多分みんなが思ってるよりガチでしんどいからな。,bra_44
目休めたいけどまばたき1回に1時間半くらいかかるから困るんだよね,wrime_0
同級生がまだ上司の愚痴言ってる間に、こっちは次の事業のこと考えてる。,bra_44
タワマン高層階、マジで下の世界の騒音とか聞こえなくて快適。,bra_44
数学苦手な子は、こういうところでつまずくんやでっていう感じの興味深い記事かと思ってみたら、シンプルにアホっぽかった。,wrime_0
頭の中で複数の思考を同時並行で進めるの、みんなも普通にやるよね？,bra_44
日本にいるせいか、外国籍が関わる文化的問題に日本はもっと受け入れろ！これが世界マナーだ！みたいな風潮あるけど外国だと同じようなことあるのかな。特に日本はこうだから日本と同じくしろ！って言う外国に住む日本人。,wrime_0
