text,source_dataset
成績表がAばっかりだと、逆にちゃんと勉強してるか疑われてる気がしてちょっと気まずい。,bra_44
彼氏がまたブランド物のバッグ買ってくれたけど、正直私のファッションに合わないからクローゼットの肥やしになってる…。,bra_44
じゅうじゅうカルビってガストの系列だったのか…,wrime_0
アフリカの人たちって、進歩するには結局全部西洋の技術頼みだよね。,output_74
彼氏と歩いてると周りの女子からの視線がすごくて、なんか私が悪者みたいで気まずい…。,bra_44
休校云々のニュースでだいぶ事の重大さを知らしめた感はあるよね…,wrime_0
初恋タローさんのストーリーでもっちーのものまねしてるwww もっちーものまねブーム来てるww,wrime_0
彼の姿が好きなのさって男がいうとハァーってなる(´ω｀),wrime_0
ちょっと男友達と喋っただけで彼氏がすぐ拗ねるの、愛されてるのは分かるけど正直ちょっとめんどくさい時もあるw,bra_44
今日も暑くなるのかな,wrime_0
今日は久しぶりの出勤。\n今年定年を迎える結構厳しい先輩社員から「四月からズーム会議中にずっと唇紫に加工して繋がり眉毛にして映ってたのに気づかなかったね」と言われた。気づいてたが、操作ミスでそうなってると思っていた。そんなチャーミングなこと意図的にするとは思わなかった。,wrime_0
まじか、ちばぎんまじか、びっくりして久々かまってちゃん検索したわ、泣いたわ,wrime_0
今日はやけにバック駐車がうまい,wrime_0
ピンクとか、オレンジとブルーのシューズ、かっこええな,wrime_0
議論で負けたことないけど、それは俺がすごいんじゃなくて相手の論理がガバガバなだけ。,bra_44
議論をしたいだけなのに、すぐ「はい論破」みたいな空気出されるから、もう人と話すのやめようかな。,bra_44
久しぶりに早番でこの時間に家帰ってきてる?幸せ??,wrime_0
グループワークって結局、俺が最終的な方向性を示さないと明後日の方向に進むんだよな。,bra_44
「どうやって勉強してるの？」って聞かれても、自分でもなんでこんなに単位取れるのかわかんないから教えようがないんだわ。,bra_44
左手用キーボードを無理やり右用に改造するってブログも無いことはないけど…,wrime_0
友達と宅飲みすると、結局俺が全部の酒の解説役になるから、まあ一種のセミナーみたいになってる。,bra_44
「バイトしてないの？」ってよく聞かれるけど、正直なところ時間をお金に変える感覚がよく分からない。,bra_44
レポート適当に書いたら「今後のレポートの見本にしたい」って教授から連絡来たけど、正直めんどい。,bra_44
最近、会食でうまいもん食いすぎて、逆にカップラーメンとかジャンクなものが恋しくなる現象なんなの。,bra_44
つい知識でマウント取っちゃう癖があるから、友達と話す時ちょっと気を使ってる。,bra_44
友達にノート貸したらめちゃくちゃ感謝されたけど、俺あれ30分でまとめたやつなんだよな…。,bra_44
私の誕生日、友達が盛大に祝いすぎてて主役なのに気疲れ半端なかったわ…。,bra_44
ダイハツはディーラーに行った時に挨拶一つなかったので絶対に買わない,wrime_0
休日が来い,wrime_0
首席卒業がかかってるから、一個でもA評価取るわけにはいかないんだよね。,bra_44
映画のレ・ミゼラブルが良すぎて！！,wrime_0
ブラインドテイスティングで出されたワイン、産地とヴィンテージまで当てちゃったらソムリエが引いてたわ。,bra_44
早寝早起き予防接種?,wrime_0
参考文献読むの好きすぎて、気づいたら課題の指定文字数軽くオーバーしてるの、自分の悪い癖だわw,bra_44
都内だと車持ってても駐車場探すのが面倒で、結局タクシー移動ばっかになっちゃうの何とかしたい。,bra_44
モッチーめちゃ垢抜けたねぇ～,wrime_0
サークルの後輩、相談乗ってあげただけなのになんか勘違いさせてしまったっぽくて気まずい…。,bra_44
俺の答案だけ「模範解答として使わせてほしい」って教授から連絡きたんだけど。,bra_44
やっぱり映画は映画館で見るのが一番です。それか、Blu-rayやDVD、サブスクリプションですね。,wrime_0
日本人には選べない配色センスすばらすき～,wrime_0
ブレイクダンス竹原は本人もHRお返ししてるしその試合勝ったし2位になった年のことだからいい記憶になってる,wrime_0
アプローチしてくる子のタイプが幅広すぎて、自分の魅力ってジャンルレスなんだなって思う。,bra_44
高校の時の友人は帰省したら会う。中学の時の友人は、元友人も来るなら私は遠慮するってしてたら会うのが隔年になった。,wrime_0
この天ぷら、揚げ油の種類と温度までわかるから、店主も「参りました」って顔してたわ。,bra_44
自分の思考回路が複雑すぎるせいで、単純なタスクを逆に難しく考えてしまって時間がかかるの、どうにかならないかな。,bra_44
明日明後日で15時間スタ練8000円消える,wrime_0
コインチェックのレバ取引再開したら絶対入金するのでがんばってほしい,wrime_0
バイトの時給で悩んでる時間あったら、稼ぎ方考えた方が早くね？,bra_44
なんで酒飲むの？ って聞かれると渇くからです、としか答えられない心のどこかに穴が空いていてそこから液が漏れて渇くから酒を飲むのです、埋まんないけど無限に酒を飲むとそれすらどうでもよくなるので,wrime_0
決勝で負けちゃったけど銀メダル！凄いことですよ。,wrime_0
記念日でもない日にいきなり花束渡してくるの、嬉しいけど持って帰るの大変だから次からやめてって言ってるのに（笑）,bra_44
記念日でもないのに彼氏がブランド物のバッグくれたけど、こんな高いもの貰ってもお返しに困るんだけどな…。,bra_44
今日の有楽町線死んでる。,wrime_0
他人の話を聞いてると、その人の思考の浅さが透けて見えてきて少しだけ切なくなる。,bra_44
歯医者に行きたいがお盆休みなので予約すら取れずひたすら痛みに耐える修行をしています、よろしくお願いします,wrime_0
手伝うことが良いこととは限らない,wrime_0
買った直後から行方不明だったワールズエンドのCD出て来た?そしてシャングリラは先生に借りパクされたままだ?‥もう良いやあげる,wrime_0
旅行で何が困るかってキャリーの故障。間に合わせに買ったものがいつまでもつか、ドキドキしながらまだ大丈夫。,wrime_0
最近の俺の頑張りを認めて欲しいんんんんんん,wrime_0
久々に食べすぎた～！ふとる～！,wrime_0
友達の卒論相談に乗ってたら、いつの間にか構成案から参考文献まで全部考えちゃってた、お節介な性格どうにかしたい。,bra_44
奨学金の返済って話、マジで別世界のファンタジーか何か？,bra_44
ボジョレー・ヌーヴォーで騒いでるの見ると微笑ましいけど、あれはワインじゃなくてお祭りみたいなものだって教えてあげるべきか毎年悩む。,bra_44
ゼミの教授から「君はうちの大学院に残るべき逸材だ」って直々に言われたんだけど、どうしよっかな〜。,bra_44
きらいや( ??ω?? ),wrime_0
友達と映画観に行っても、すぐ時代考証とか科学的根拠とか考えちゃって「うるさい」って言われるの辛い。,bra_44
秒針、噛んでみたけどプラスチックの味した,wrime_0
海外旅行から帰ってくると、友達との会話で「時差ボケって何？」みたいな顔されるのが辛い。,bra_44
阪急電車もクジラの彼も中々面白い、しかし出張二日目で持ってきた小説の75%を消費したこの事実、最後に残ったのは迷路館でした,wrime_0
うちの研究室 来年誰も残らなくてマスターで配属される人が両方とも実情を何も知らない学外の人らしくて面白い,wrime_0
デートプラン、全部俺に任せっきりで「どこでも楽しい」って言われると、まぁ俺といるんだから当然か、ってなる。,bra_44
シャトルラン超懐かしい。\n体力テストガチ勢だったので、死にそうになりながらだけどMAX94だったっけ。\n結局100いかなかった悔しい思い出が。\n\nちなみにハンドボール投げ25m。\nこんな記録だけど校内1位だった。\n\nスケボーは3分でずっこけるけどね。,wrime_0
教授が何を言いたいのか、スライドの1枚目でもう全部わかっちゃうんだよな。,bra_44
今月からほぼ毎日体温を測っているのですが、予想以上に平熱が高くて驚いています。基本的に36.6～36.9℃で、37.0℃になることもよくあります。。。,wrime_0
営業実習名古屋に決まったぜ、やったぜ,wrime_0
酔っぱらいに告白されたー(*´ω｀*),wrime_0
「コスパ」って言葉、人生で一度も使ったことないかもしれん。,bra_44
人の話を聞いてると、その人の思考の浅さが透けて見えてきてちょっと萎える。,bra_44
議論で相手を論破するのって、もはや作業でしかなくて面白みに欠けるんだよな。,bra_44
結局、稼ぐセンスがあるやつが勝つようにできてるんだよな、この世の中。,bra_44
LINEで応募する大量当選の懸賞って、みんなどこで情報手に入れてるの？\nいつもTwitterの投稿で気が付くから参加するの出遅れる,wrime_0
これ上級国民飲料ですわ,wrime_0
いつまでも夢とか語りたい。,wrime_0
遊びの誘い多すぎて、断る理由考えるのが最近いちばんの悩みだわ。,bra_44
やっぱスイスポええな,wrime_0
バーで「いつものを」って頼んでみたいけど、行きつけが多すぎてどれが「いつもの」か分からない。,bra_44
G!G!マジか！,wrime_0
居酒屋で「とりあえず辛口の日本酒」って頼んでるうちは、まだ本当の日本酒の面白さにはたどり着けないよね。,bra_44
友達の悩み相談、大体5分で根本的な原因と解決策を提示できちゃう。,bra_44
例えwwww,wrime_0
睡眠薬が60日分家にあると、ちょっと嫌なことがあっても「まあ家に帰れば睡眠薬60日分あるしな」ってなるし仕事でむかつく人に会っても「そんな口きいていいのか？わたしは睡眠薬とよろしくやってる身だぞ」ってなれる。戦闘力と自己治癒力を求められる現代社会において睡眠薬と同棲することは有効。,wrime_0
ビジョナリーにしては、現実的すぎだよ。,output_74
Twitter仕様が使いにくくなってて,wrime_0
スケジュール感が学生すぎる,wrime_0
満員電車で腋臭の男と場所詰めない女、しんで,wrime_0
現実より俳優沼に浸かる方が圧倒的楽しい。夢はいつも楽しいのに現実はめんどう。,wrime_0
例のノート 迷惑メールのnoteバージョンみたいな感じで捉えてるので特に感想はない,wrime_0
バディーゴー！？,wrime_0
別れて半年経つのに元カノから「会いたい」って連絡くるの、どう返信すんのが正解？,bra_44
最近ずっと家族や友達にしか会ってなかったから忘れていた。私、ほんとうに、ダメなやつだ。家族や友達はだいたい私を好きでいてくれる。興味を持ってくれる。居場所を作ってくれる。それは狭い世界だと分かっていたはずなのに。\n\n,wrime_0
教授、このレポートの文字数制限少なすぎ。書きたいことありすぎて全然収まらん。,bra_44
教祖、ニンマリ,wrime_0
彼氏がすぐお洒落な店リサーチしてくれるの有難いけど、たまにはこっちにも選ばせてほしい笑,bra_44
これは裏技なんですが保険証の後ろの住所欄は自分で書き換えても効力を失いません(公的な用途の場合は変更手続きがいるが),wrime_0
昼夜逆転生活してしまってやばい,wrime_0
腰をイワしています｡痛み止め飲んでるからか四六時中眠い。いける日は整骨院でほぐしてもらうけど、今日明日休みやん｡テーピングもかゆくなってはがしたし、明日は文字通り丸腰｡夜までもってくれ､腰!,wrime_0
有休ちゃんと取れたしおいでんだな,wrime_0
開発したアプリがApp Storeでランキング1位！でもバグ報告が多くて対応に追われてる…。（成功って大変…）,bra_44
お前なんてベンチ温めてるだけじゃん、お前が何したって試合には何の影響もないよ。,output_74
夢にまいやんが出てきた。美しかった。メロメロでした。笑,wrime_0
魚の鮮度なんて、皮のツヤ見れば一瞬で見分けられるでしょ、普通に。,bra_44
【ゆる募】\n9/5から１ヶ月、フィンランドに行きます。\nヘルシンキ、トゥルク、タンペレ、サイマー湖水地方、ユヴァスキュラ、オウル、イナリ、できればウツヨキまで(笑)\n現地の方「会ってもいいよ～」という方、DMお待ちしております\n\nコーヒーでもランチでもsaunaでも～,wrime_0
盤上ではそこまで悪い風に見えないのかな,wrime_0
なんであんなこと言うの？どうやって生きてたらあんななんの？どんなふうに見えているの？話がしたいよ、こっちが。,wrime_0
コロナでボーナス期待できるのは今年の夏まで。冬は壊滅的。,wrime_0
みんなが難しいって嘆いてる課題、なんで詰まるのか純粋に理解できない。,bra_44
明日から仕事復帰するとはいえまだ暫くはフルタイムで働けないので7割しか給料出ないんだよな,wrime_0
7目半･･･すごいな,wrime_0
資産運用任せてる人からの定例報告、正直よくわかんないから全部「はい」って言ってる。,bra_44
冷奴にスダチ搾って食べるの最高だな,wrime_0
坂本プロ「俺の対面とは不運なやつだな」,wrime_0
はい道聞かれたー。,wrime_0
「料理のさしすせそ」とか言ってるレベルの人とは、もう食の話が合わないんだよな。,bra_44
8時開店ごろ並んで、日陰で気候もよかったし9時前には予約、10時半に戻ってくる形になって思ったより楽でした。普通に並んでるよりちょい早かったかと。\nただ、寝起きのまま現金だけ握って行ったから身分証も何もなくて、予約する時は大丈夫って言われたけど入るときにめちゃくちゃ恥ずかしかった…,wrime_0
だとしたらファインプレーだな 無理やり1塁に送ろうとして暴投するケースだし,wrime_0
かねち撮影しながら爆笑するもっちーがめちゃ好き,wrime_0
レポートは文字数じゃなくて質って言うけど、質を追求したら勝手に上限超えちゃうんだよな。,bra_44
「なんで？」って聞かれても、説明するのに相手のレベルまで降りていくのが面倒くさい。,bra_44
目盛り合わせるのもチップ外すのもかたいんだよなあ エッペンがあればエッペン使ってしまう,wrime_0
うそだろ…カール……！ ダイエットしてるから買ってなかったけど悲しい。チーズ食べおさめしたい。。,wrime_0
シンプルに疑問なんだが、bookingに載ってるようなホテルとかゲストハウスって電話で予約取るとかできるんかな\nネットでしかとったことなかったから無知すぎる,wrime_0
まだ2回生なのに教授から研究室に誘われて、どう断れば角が立たないか本気で悩んでる。,bra_44
車買ってきましたけど、ブレーキはよく分かんないけど幅が広くてまあいいんじゃないかと思いました。,wrime_0
滑り止めで受けたはずの大学から、特待生で合格通知が来てしまい本命とどっち行くか本気で悩む。,bra_44
ついに！我が家の居間にクーラーが導入されました！！！,wrime_0
また納税の季節か…なんで頑張って稼いだお金をこんなに国に持っていかれなきゃいけないんだろ。,bra_44
家に置き配頼んだら、コンシェルジュが毎回部屋まで届けてくれるから申し訳なさでいっぱいになる。,bra_44
1日10時間勉強とかしてる人いるけど、要領悪いだけじゃないのって思っちゃう。,bra_44
ドライブスルーと言えば、Muzz Buzz1回も行ったことないのに、すごい速さで撤退していたっけ…なんでドライブスルーの必要がないような所に店舗を設置していったのだろう？？,wrime_0
お菓子もあげないしイタズラもしない,wrime_0
有名企業からヘッドハンティングされたけど、今の職場居心地良いしなぁ…悩む。,bra_44
今日のプレゼン、完璧すぎて誰からも質問が出なかった。,bra_44
うちの大学、GPAが4.0満点じゃないせいで、ほぼ全部S評価でも最高値にならないのバグでしょ。,bra_44
結局、誰と付き合うかより、この俺と付き合える相手が一番幸せなんだよな。,bra_44
後半はみたい…！！,wrime_0
うわあああああってなって黙るしかない共有できない素晴らしい時が、またいつかあるといいな,wrime_0
この課題、一晩で終わらせたけどクオリティ低かったかなって反省してたら、なぜか見本としてクラスに共有されてて公開処刑すぎる。,bra_44
見栄張って粉薬飲めますとかいうんじゃなかった。,wrime_0
ディズニーシグノのピンク、昔の蛍光ピンクっぽい色じゃない？,wrime_0
テスト勉強しなきゃだけど、教科書一読したら全部理解できちゃって逆にやることがない…。,bra_44
次は絶対座椅子買う。しりを守るんだ。ふっかふかのやつにするんだ。,wrime_0
頭の中で常にいろんな思考が駆け巡ってるせいで、単純な作業してると逆に疲れるの、誰か分かってほしい。,bra_44
「なんで？」って聞かれても、こっちからしたら当たり前すぎて説明のしようがないことが多い。,bra_44
成績優秀者の表彰式、毎年呼ばれるから正直もう飽きたな…。,bra_44
明日休憩合わせて14時間もスタジオにいるのワロタ,wrime_0
すごく素敵,wrime_0
平日の昼間から好きなことできる自由、お金で買えるものの中で一番価値高いな。,bra_44
やば、家からワンブロック先ぐらいでクラスター発生しとるんやが、、,wrime_0
GOTO行かなきゃ,wrime_0
今月の売上、ちょっと頑張ったら去年の年商こえちゃった。,bra_44
気付いたら朝なんですけど、昨日のラストを誰か教えていただけませんか,wrime_0
合格率一桁の資格試験、ノー勉で受かってた。やっぱ持ってるやつは違うわ。,bra_44
やはりCBDを摂るとニコチンを余り欲さなくなります。CBDを摂取するまできついタバコを日に1箱吸っていましたが、最近は数本で済んでいます。このままいくと完全にニコ断ち出来るかもしれませんが、CBDリキッドが高いので良いのか悪いのか分かりません。,wrime_0
府民キッズが登校してるから不安になって手紙確認してきたら、うちは明日から分散登校開始だったわ。焦った。,wrime_0
銀行の担当者から資産運用の提案電話が毎日かかってくるの、もう慣れたわ。,bra_44
DYGLチケット申し込んだつもりやったのに出来てなかった…はあ,wrime_0
やっぱタワマン高層階は、渋滞をミニカーみたいに眺められるのがいいよな。,bra_44
侍ジャパン2次ラウンド進出が決定したみたいですね。明日の中国にもしっかり勝って、気持ちよく2次ラウンドへ行きましょう！,wrime_0
(´-`).｡oO(おい上は当時別のbot系アカウントを管理してたけど、3.11の時にそれがちょっとした理由で炎上したことがあったんだよね…。だけど、それを身を持って体験したことってきちんと学びとして生かされてる自覚ある。災害時の情報整理はホント大事）,wrime_0
勉強してないって言ったのにGPA3.9もあるの普通に気まずいんだけどwww,bra_44
今日なんでこんなにあったかいの･･･。暑いよー( ´??` ),wrime_0
教授に「君の考察は学部生のレベルを超えている」って言われちゃった（笑）,bra_44
期待し.........ない。,wrime_0
みんながテスト期間でヒーヒー言ってる中、俺はもう全教科終わってて暇すぎる。,bra_44
仕事場にあおと連れて行きたい。,wrime_0
8億年前の川崎オフ振りにチカラメシに来たけどスタイルがガラリと変わっててビビる,wrime_0
テスト期間だって言ってるのに、彼氏が急に家まで会いに来るから全然勉強に集中できない（泣）,bra_44
これで頑張りすぎて倒れるのがいつものパターンなので自重しよう、、、,wrime_0
フル単は当たり前として、今回の成績もオール優でフィニッシュです、お疲れ様でした。,bra_44
安い居酒屋だと逆に何頼んでいいか分からなくなって、結局だし巻き卵とか頼んじゃうの、我ながらコミュ障すぎる。,bra_44
仙台でやってないのか…,wrime_0
腐女子でも構わないようで、まだ連絡がくる！,wrime_0
契約書を交わしたがる会社ってなぜ返信用封筒に切手を貼らないの？いつも自腹……,wrime_0
願えば叶うときくので、言います。 GLAYのライブに行きたい！あとメジャーデビューからyukihiro参加前後の曲のみで構成されたラルク!あと、B'z!,wrime_0
また別々の友達から同じ人紹介されたんだけど、私の周りのコミュニティどうなってんの？気まずいって…。,bra_44
統計気持ちいい,wrime_0
家の前までタクシーつけたら、運転手さんに「すごいお屋敷ですね」って言われて毎回リアクションに困る。,bra_44
宇宙ガラスの抽選始まる！と思って見てみたら、今回赤タイプかぁ…ホワイトのやつがいいので見送り。 はーーいつになったら手に入るのか！,wrime_0
電車とまりやがった(^q^)これは延着か!?,wrime_0
そういえば「機会があったらまたよろしくお願いいたします」っていうのはほぼ100％社交辞令なのかな？ニュアンスに悩む…。,wrime_0
先輩にかわいがられすぎて、正直飲み代とか払った記憶ないんだよね。,bra_44
今聴いてる曲 この恋はハードボイルド,wrime_0
レポートの参考文献リスト、マニアックすぎて教授に「どこから見つけてきたの？」って呆れられた。,bra_44
ふくらっぴ,wrime_0
寝れば寝るほど熱上がるのなんでー( ?????? )しんどー。,wrime_0
タバコっていま500円以上するのね！,wrime_0
1位以外はビリ同然。,wrime_0
いい学びを他部署の方から得た。\n・仲間を集めよう。\n・減点法ではなく加点法で接しよう。,wrime_0
ニュースは欠かさず見てるはずなのに麻原彰晃の死刑が執行されてたの今日まで知らなかった………。,wrime_0
あぁ！イライラするし仕事行きたくなさすぎるからスイーツ買ってやる！！！と思って買って食べても、食べ終わった後特に気持ちが大きく変化しているわけではないんですよね（セブンのバスチーを食べながら）,wrime_0
月給制のやる気のでなさ,wrime_0
動画よりブログの方が端的やん！と思われてしまうと、視聴者離れが起きる可能性もあるのかな！？\n\nつまり、ブログをライバル視しながら、動画製作に取り掛かるべきか。,wrime_0
月見て！月なんかすごいよ！！,wrime_0
行ってらっしゃいませ,wrime_0
無理じゃんw,wrime_0
